Jobtitle,Company,Location,Job Position,Salary Min,Salary Max,Job Description
"Assistant Manager, Transfer Pricing (Bangkok Based, Relocation Provided))","Agoda Services Co., Ltd.",Bangkok,Taxation,Full time,,,"Assistant Manager, Transfer Pricing (Bangkok Based, Relocation Provided)) Apply Now Bangkok, Thailand About Agoda Agoda is an online travel booking platform for accommodations, flights, and more. We build and deploy cutting-edge technology that connects travelers with more than 3.6 million accommodations globally. Based in Asia and part of Booking Holdings, our 6,000+ employees representing 90+ nationalities foster a work environment rich in diversity, creativity, and collaboration. We innovate through a culture of experimentation and ownership, enhancing the ability for our customers to experience the world. Get to Know our Team: Agoda has taken many great strides in recent years, expanding our reach around the globe as well as our list of travel products and services. A critical driver to this success has been the team of Agoda Finance. We keep a steady hand on maintaining day-to-day financial operations while also keeping an eye out for future opportunities. Not only do we have the unique role of balancing risk management with continued innovation and growth, but we also serve as a means of empowerment for both our team members and those within the company. Having experimentation and data analysis deeply ingrained in our culture, we provide the strategic insights Agoda’s business leaders need to push into new territories in sustainable and scalable ways. We also prioritize career development in Agoda Finance. Every function within the team has a well-defined career track with clear goals and development targets each step of the way. The Opportunity: Booking Holdings, listed at NASDAQ, is the world leader in online travel and related services. Agoda is part of the Booking Holdings family and located in Asia-Pacific. Due to the ongoing development of new products (i.e. adding travel related products on our platforms) and global tax and transfer pricing regulation changes, we are looking for additional expertise to grow our Transfer Pricing Center of Expertise in Asia. The main focus of this position is assisting with all tax matters related to transfer pricing for Agoda, including the compliance with tax regulations in all countries where Agoda operates as a business (with a focus on transfer pricing documentation), assistance in restructuring projects, supporting the legal and tax function on potential transfer pricing controversies  as well as  effectively managing the relationships with the company’s advisors. As a Assistant Manager Transfer Pricing you will be part of the Booking Holdings Transfer Pricing Center of Expertise. You will support (Senior) Tax Managers with their end-to-end responsibility from scoping the issue/challenge (incl. budgeting) to the overall solution (incl. execution and implementation), including stakeholder management, driving issue resolution, initiating the needed change management and monitoring. The role involves interaction with Agoda’s entire tax team, Agoda functional leads, our parent company Booking Holdings (based in Norwalk, Connecticut, USA), and the other brands in the Booking Holdings group, our international offices, business managers, functional teams and other finance colleagues. Therefore it is essential that you have excellent, social, management and communication skills in English. Data modelling and accounting knowledge is also a plus. Due to the rapid growth of the organization, the tasks and duties of this role may evolve over time. You will be keen to develop and grow within the role and to take on additional challenges and responsibilities as they occur. The role requires travelling. This role would preferably be based in Bangkok. In this Role, you’ll get to: Monitor and maintain transfer pricing- and other tax compliance across the business, including the drafting of local transfer pricing documentation; Support in planning strategies, including modelling various scenarios; Contribute to tax awareness and appreciation within the group by educating cross-functional teams; Ensure compliancy with local rules and regulations; Project/coordination responsibilities; Conduct internal transfer pricing risk assessment and recommend tax compliance enhancement opportunities; Prepare functional and financial analyses, TP documentation, and assist with automation efforts; Monitor and analyze proposed and newly enacted transfer pricing legislation, regulations and judicial decisions that impact the company operations and financial positions. Coordinate the work of our tax advisors; Interface with outside advisors to manage Agoda’s international structure. What you’ll Need to Succeed: University or other high level degree in Tax Economics/Law/Business Administration or similar degree, preferably; 3-5 years of working experience in Transfer Pricing within a big 4 and/or international environment; Local transfer pricing knowledge within the APAC region is preferable Combination of experience with tax compliance/accounting/treasury is preferred; Excellent knowledge of the international tax regulation. Self starter, flexible, energetic, passionate, self-motivated, and results-oriented professional; Accurate, able to work under pressure and to strict deadlines, and comfortable working in a fast turnaround environment; Ability to think strategically, multi-task, and work effectively and efficiently with minimum direction; Exceptional interpersonal skills with the ability to interact with all levels of management; Ability to have good grasp of the detail whilst understanding the “big picture”, and to manage multiple tasks and priorities simultaneously; Organized, proactive and common sense; Ability to be a hands-on deliverer; Excellent communication skills (both written and verbal) in English; Social and a team player; Willingness to travel. #LI-SS2 #FIN #Tax #TransferPricing #bangkok #jakarta #kualalampur #philippines #indonesia #singapore #taiwan #phuket #newdelhi #mumbai #vietnam #malaysia #india #poland # czechrepublic #luxembourg LI-SS2 #LGL #3 #manila #seattle #singapore #amsterdam #seoul #taipei #dublin #washingtondc #shanghai #newyorkcity #london #sanfrancisco #munich #chicago #tokyo #boston #hongkong #kualalumpur #brussels #paris #frankfurt #sydney #melbourne #perth #beijing #paris #zurich #geneva #wroclaw #taipei Equal Opportunity Employer At Agoda, we pride ourselves on being a company represented by people of all different backgrounds and orientations. We prioritize attracting diverse talent and cultivating an inclusive environment that encourages collaboration and innovation. Employment at Agoda is based solely on a person’s merit and qualifications. We are committed to providing equal employment opportunity regardless of sex, age, race, color, national origin, religion, marital status, pregnancy, sexual orientation, gender identity, disability, citizenship, veteran or military status, and other legally protected characteristics. We will keep your application on file so that we can consider you for future vacancies and you can always ask to have your details removed from the file. For more details please read our privacy policy. To all recruitment agencies: Agoda does not accept third party resumes. Please do not send resumes to our jobs alias, Agoda employees or any other organization location. Agoda is not responsible for any fees related to unsolicited resumes."
Head of Commercial Flights (Bangkok-Based),"Agoda Services Co., Ltd.",Bangkok,Financial Accounting & Reporting,Full time,,,"Head of Commercial Flights (Bangkok-Based) Apply Now Bangkok, Thailand About Agoda Agoda is an online travel booking platform for accommodations, flights, and more. We build and deploy cutting-edge technology that connects travelers with more than 3.6 million accommodations globally. Based in Asia and part of Booking Holdings, our 6,000+ employees representing 90+ nationalities foster a work environment rich in diversity, creativity, and collaboration. We innovate through a culture of experimentation and ownership, enhancing the ability for our customers to experience the world. Location: Bangkok Market taking care of: APAC The opportunity: Agoda first started selling air tickets in late 2019; we are currently looking to grow the commercial team in APAC to help grow our young Flights business into a market leader in APAC. As the Head of the Flights Commercial Team, you will have the responsibility of looking after all our partners in APAC. You will be directly leading and managing a team of Flight Commercial Managers based in APAC. The team will be responsible for identifying new partners and opportunities, cultivating a relationship with our partners, and working together with them to deliver the best outcome for our end customers. You will also be working closely with other teams within Agoda to ensure the partners needs are met. You will report to the VP of Supply (Accommodations and Air) in the Supply Department. You will be supported by a team within the Supply department and work closely with other Flight Team members within Agoda (Product, Finance, Marketing). You will have the opportunity to be part of an exciting and brand new team and new business vertical for Agoda and have the rare opportunity of joining a ‘start-up’ within an established company. In this role, you are responsible for: Overseeing the Flights Commercial team in APAC Developing and executing business strategies and plans to achieve short- and long-term goals for the business and also for each market; Ensure overall management of partners and performance in markets; including commercial negotiations, operations, pricing and availability; Working closely with other Flights stakeholders within Agoda (Product, Marketing, Finance, Legal, Tax) to ensure overall joint growth of the Flights business; Maintaining positive and trust-based relations with air suppliers and key business partners overall; Having a strong sense of Ownership and end to end responsibilities on the business. Detail oriented and able to be deeply involved in understanding the needs; Ability to negotiate, communicate, manage difficult conversations and build strong and trusted relationship with partners Analyzing the online travel ecosystem, markets, competitive landscape, and requirements; Identifying, conceptualizing, launching, and optimizing products and features, experimenting, testing their performance, and iterating quickly; Developing innovative solutions to difficult problems by collaborating as needed across regions, product areas, and functions; Managing communications to key senior stakeholders in Agoda, updating on business performances, risks and issues and optimization plans. What you’ll need to succeed: Proven experience as a senior leader in a commercial or partner facing role within Agoda; (Directors and above) or OTA experience covering multiple aspects (Product knowledge, Operations, Commercial negotiations, Legal) preferred or Flights industry experience (preferably within APAC) in multiple domains such as supply/distribution, user experience, marketing, customer service, tax, legal, etc.; Successful experience directly managing any commercial, account management or sales teams in a relevant industry Proven ability to develop and design cohesive, realistic and ambitious plans for growth Proven ability to leverage analytics and data to inform and influence decision-making; Excellent communication skills (both verbal and written in English) Entrepreneurial and analytical skills; able to break down complex problems and driving and managing change; Hands-on mentality; Demonstrable experience in developing strategic initiatives and end-to-end business plans; It’s great if you have: MBA or Master’s degree in Mathematics, Economics, Computer Science or Statistics; and Comfort using data tools such as SQL, Python, R or equivalent. #Bangkok #Thailand #Malaysia #Indonesia #Hong Kong #Singapore #China #Japan #South Korea Equal Opportunity Employer At Agoda, we pride ourselves on being a company represented by people of all different backgrounds and orientations. We prioritize attracting diverse talent and cultivating an inclusive environment that encourages collaboration and innovation. Employment at Agoda is based solely on a person’s merit and qualifications. We are committed to providing equal employment opportunity regardless of sex, age, race, color, national origin, religion, marital status, pregnancy, sexual orientation, gender identity, disability, citizenship, veteran or military status, and other legally protected characteristics. We will keep your application on file so that we can consider you for future vacancies and you can always ask to have your details removed from the file. For more details please read our privacy policy. To all recruitment agencies: Agoda does not accept third party resumes. Please do not send resumes to our jobs alias, Agoda employees or any other organization location. Agoda is not responsible for any fees related to unsolicited resumes."
"Finance Vendor Management Senior Analyst (Bangkok based, Relocation Provided)","Agoda Services Co., Ltd.",Bangkok,Financial Accounting & Reporting,Full time,,,"Finance Vendor Management Senior Analyst (Bangkok based, Relocation Provided) Apply Now Bangkok, Thailand About Agoda Agoda is an online travel booking platform for accommodations, flights, and more. We build and deploy cutting-edge technology that connects travelers with more than 3.6 million accommodations globally. Based in Asia and part of Booking Holdings, our 6,000+ employees representing 90+ nationalities foster a work environment rich in diversity, creativity, and collaboration. We innovate through a culture of experimentation and ownership, enhancing the ability for our customers to experience the world. Get to Know our Team: Collections function within Credit Risk and Collections team is responsible for the collection from hotel partners for various product offerings. It also provides analytical support on various data requirements and is also responsible for collections MIS and reporting activities. This function manages the end-to-end management of Agoda’s external Debt Collection Affiliates. This team is expanding, and we are looking for Collections Vendor Management Senior Analyst to be based out of Bangkok, Thailand. The Opportunity: Agoda is seeking a Collections Vendor Management Senior Analyst to lead and innovate our external debt collection process operations. This is an individual contributor role. In this role, you will play a pivotal part in optimizing collections processes, enhancing our relationships with external debt collectors, and driving financial outcomes. We are looking for a creative and proactive individual who can collaborate effectively with our collections team to achieve outstanding results. In this role, you’ll get to: Become Agoda’s subject matter expert (SME) for our external vendors i.e.  Global Debt Collection Agencies (DCA) and law firms. Coordinate with external vendors and own their end to end operations and efficiency improvements: This includes establishing robust procedures, assignment and withdrawal of accounts, managing payments, and responding to their inquiries. Collaborate with the broader Collections team on cases requiring external vendor involvement and facilitate communication with internal stakeholders Drive vendors to meet collections target and to positively influence Agoda P&L. Contribute with effective ideas to automate manual processes and work with key stakeholders on implementing identified solution. What you’ll Need to Succeed A minimum of 1 year vendor management or coordination related experience is required Candidate with collection background would be preferred. Organized and detailed oriented Strong organizational skills and attention to detail. Approach challenges in a passionate, innovative, and decisive attitude. Ability to work efficiently & independently, and to adapt to a fast-paced working environment. Passionate and a fast learner in line with Agoda values. Ability to problem solve and meet deadlines as agreed. Must be extremely confident, proactive and take personal ownership of task completions. Proficiency in Microsoft Excel SQL knowledge is a plus. This role would be based out of Bangkok, Thailand. #Bangkok #Kualalumour #Manila #Hanoi #Makati #Lahore #Karachi #Delhi  #Mumbai Equal Opportunity Employer At Agoda, we pride ourselves on being a company represented by people of all different backgrounds and orientations. We prioritize attracting diverse talent and cultivating an inclusive environment that encourages collaboration and innovation. Employment at Agoda is based solely on a person’s merit and qualifications. We are committed to providing equal employment opportunity regardless of sex, age, race, color, national origin, religion, marital status, pregnancy, sexual orientation, gender identity, disability, citizenship, veteran or military status, and other legally protected characteristics. We will keep your application on file so that we can consider you for future vacancies and you can always ask to have your details removed from the file. For more details please read our privacy policy. To all recruitment agencies: Agoda does not accept third party resumes. Please do not send resumes to our jobs alias, Agoda employees or any other organization location. Agoda is not responsible for any fees related to unsolicited resumes."
Accounting,Collective,"Ko Samui, Surat Thani",Financial Accounting & Reporting,Full time,,,จำนวนอัตรา 7 จังหวัด เกาะสมุย ระดับการศึกษา ไม่ระบุ รายละเอียด - Custer Cost Controller 1 position ด่วน - GCR/Paymaster Supervisor 1p - AR/Income officer 1p - AP Officer 1p - Receiving/Store officer 1p - Purchasing Manager 1 position ด่วน - Receiving Clerk/Store 1 position ด่วน สวัสดิการ - Competitive benefit salary with service charge - Competitive annual vacation entitlement - Learning and Development Program - Free meals at work - Uniforms - Group Insurance - Annual Health Examination เวลาทำงาน ประจำ เงินเดือน ไม่ระบุ บาท สนใจติดต่อ HR เบอร์โทร 0635142450 อีเมล์ careers@socialtel.com เว็บไซต์ www.collectivehospitality.com
Manufacturing Specialist I,Seagate Technology (Thailand) Ltd.,Samut Prakan,Audit - External,Full time,,,"Teparuk Operations is responsible for hard disc drive assembly and test, ensure quality and cost in control and deliver hard disc drives to customers in time. Teparuk Operations is an exciting and motivated team. In this role, you’ll have an opportunity to develop yourself. Be responsible for all aspects of the production process: deliver, assembly, visual check, load/unload, pack/unpack, wipe, wash, sort, operate some auto-machine, use some tools, pick and place, paste and remove Work from process sheets or written/verbal instructions Acquire job skills and learns company policies and procedures to complete routine tasks Work under close supervision Operate machinery or computer devices to produce a product or service Willing to work 12 hours permanent day or night shift Able to read in English Able to perform checks with the microscope Secondary school certificate or equivalent Home to 4,000+ employees, our Teparuk site produces nano-recording heads, a crucial component of the read/write functionality of a hard disk drive. Our Teparuk facility is a fun and active site. Here at work you and your colleagues can grab breakfast, lunch, dinner and snacks at our 24-7 on-site canteen and coffee shop. Get in a few laps around our running track or enjoy volleyball, ping pong, badminton or football through our on-site gymnasium and fitness center. We also offer music, dance and yoga activities. Enjoy many on-site festivals and celebrations as well as opportunities to give back to the local community. Location : Teparuk Thailand Travel : None"
ASSISTANT CHIEF ACCOUNT,"Tawaravadee Resort Co., Ltd.",Prachin Buri,Financial Accounting & Reporting,Full time,,,"Last Updated : 25.12.2023 | Viewers 1,134 Salary : เงินเดือน 25,001 - 30,000 (THB) Types of employees : ประเภทงาน Full-time เต็มเวลา Area : ปฎิบัติงานที่จังหวัด Education : การศึกษา Bachelor's Degree ปริญญาตรี Experience : ประสบการณ์การทำงาน 5 Year (ปี) Gender : เพศ Male/Female ชาย/หญิง Age : อายุ Non-Specific ไม่จำกัดอายุ Unit : จำนวนรับ 1 อัตรา New Graduated : นักศึกษาจบใหม่ No ไม่รับพิจารณา Foreigner : ชาวต่างชาติ No ไม่รับพิจารณา Disabled : ผู้พิการ No ไม่รับพิจารณา Night shift : ตำแหน่งงานกะดึก No ไม่ใช่ Job Qualifications ข้อกำหนด ป.ตรี สาขาการบัญชี ประสบการณ์ด้านการใช้โปรแกรม Camen จะพิจารณาเป็นพิเศษ Job Details รายละเอียดงาน 1. Reconciles and maintain balance sheet accounts 2. General ledger operations 3. Prepares journal entries 4. Assists with monthly closings and preparation of monthly financial statements 5. Assists with preparation of monthly financial reports 6. Assists with accounts receivable and accounts payable 7. Assists with tax computations and returns 8. Assists in budgets and forecasts 9. Assists with payroll administration 10. Account / bank reconciliations 11. Assists with preparation and coordination of the audit process 12. Assists with implementing and maintaining internal financial controls and procedures Welfare สวัสดิการ Service charge หอพักพนักงาน อาหารฟรี 2 มื้อ ประกันสุขภาพกลุ่ม Contact ข้อมูลติดต่อ คุณณิทชาภา จ้อยสาคู ( 037 210444 ) 77 หมู่ 7ตำบลท่าตูม อำเภอศรีมหาโพธิ จังหวัดปราจีนบุรี 25140 เว็บไซต์ : http://www.tawaravadeehotel.com/ อีเมล์ : เบอร์โทรศัพท์ :"
MEL Coordinator,Company Confidential,Bangkok,Business Services & Corporate Advisory,Full time,,,: Community Partners International (CPI) : 1 Dec 2023 15 / December / 2023 View PDF
Senior Officer AP/AR,THAI UNION GROUP PCL.,"Mueang Samut Sakhon, Samut Sakhon",Taxation,Full time,,,"Thai Union Group Public Company Limited Position : Senior Officer-AP/AR Job Responsibility : • Ensure all invoice records are completed and accurate. • Perform analytical reviews of financial and non-financial
data for Balance Sheet and P/L preparation. • Prepare monthly and quarterly report or ad hoc report as
per requirement by management. • Journal entries and transactions related month end closing. • Coordinate and complete quarterly/annual audits with
internal and external auditors. • Liaise with related parties such as auditors, purchasing
department, suppliers etc. • Monitor the daily ad hoc requests when assigned by the
management. • Understand the Withholding tax and input tax. • Ensure all monthly tax reports are prepared,
reconciliation, and submitted on time. • Perform vendor reconciliation. • Identify and highlight the issue, think out of the box, and
improve the process. Job Specification : Bachelor’s
 degree in accounting Knowledge &
 experience in SAP would be a plus Good
 communications and interpersonal skills Service minded,
 self-driven and motivated Able to
 communicate in English At least 3
 years’ experience in accounting field. Good knowledge
 of WHT, Vat and Tax. Good command of
 English. Proactive,
 initiative, independent and good interpersonal skills. Able to work
 under pressure. Benefits and Welfare : Bonus Provident Fund Diligence allowance Annual health check program Group insurance Medical allowance Other allowance (Company policy) Expense allowance and pension allowance Uniform Dormitory Training Course Gymnasium Travelling allowance / Recreation activities Work Date : Monday to Friday Work Location : Head Office : 72/1 Moo 7, Sethakit 1 Road, Tambon Tarsrai,Amphur Muangsamutsakorn, Samutsakorn 74000  Map Contact : Khun Naruewan 0625970258 Email : Naruewan.Sangsukiam@thaiunion.com"
