Jobtitle,Company,Location,Job Position,Salary Min,Salary Max,Job Description
Accounting Supervisor (Bangkok Based),"Agoda Services Co., Ltd.",Bangkok,Financial Accounting & Reporting,Full time,,,"Accounting Supervisor (Bangkok Based) Apply Now Bangkok, Thailand About Agoda Agoda is an online travel booking platform for accommodations, flights, and more. We build and deploy cutting-edge technology that connects travelers with more than 3.6 million accommodations globally. Based in Asia and part of Booking Holdings, our 6,000+ employees representing 90+ nationalities foster a work environment rich in diversity, creativity, and collaboration. We innovate through a culture of experimentation and ownership, enhancing the ability for our customers to experience the world. The Opportunity This accounting role will work across Agoda’s core operational entities which mainly focus on accommodation and flight reservation. The Accounting Supervisor will have the opportunity to explore the accounting and finance of an online travel agency with all functions that drive OTA products. You will also have a chance to coordinate with other brands within Booking Holdings and be exposed to international accounting and finance. Unique to this role, you will also be responsible for the reporting and validation of one of the key material items in Agoda’s P&L and Balance Sheet which will require liaison and direct interaction with key stakeholders throughout the whole of Agoda including direct interaction with C-level. In this Role, you’ll get to: Financial Accounts Maintain accounting records including journal entries Maintain and control over fixed assets register Be responsible for the reporting and validation of one of Agoda’s key material financial items Issue and control over invoices, tax invoices, receipts Coordinate with intercompany related to month-end closing and confirmation Correspond with external auditors for statutory financial report Identifying and communicating issues to the Manager Assist accounting manager on ad-hoc assignment Reporting Prepare financial closing, reporting packages and accounts reconciliation Prepare detail reports to support manager on the quarterly Balance Sheet review with FC and CFO What you’ll Need to Succeed: 3 years’ experience in accounting field Graduated Bachelor in Accountancy Accounting standard knowledge (e.g. IFRS, US GAAP, and Local Accounting Standard) Preparation of Statutory reports Proficient ERP Software (Oracle is preferable) Strong communication and coordination skills Microsoft office packages (mainly Excel and PowerPoint) It’s Great If You Have: Experience in preparing financial statements under US GAAP and Singapore Financial Reporting Standards (SFRS) Proficient ERP Software (Oracle is preferable) Accounting experience in online travel agency business ** Bangkok based role, with relocation provided ** #Bangkok #phuket #changmai #manila #jakarta #hongkong #shanghai #beijing #tokyo #singapore #kualalampur #hochiminh #hanoi Equal Opportunity Employer At Agoda, we pride ourselves on being a company represented by people of all different backgrounds and orientations. We prioritize attracting diverse talent and cultivating an inclusive environment that encourages collaboration and innovation. Employment at Agoda is based solely on a person’s merit and qualifications. We are committed to providing equal employment opportunity regardless of sex, age, race, color, national origin, religion, marital status, pregnancy, sexual orientation, gender identity, disability, citizenship, veteran or military status, and other legally protected characteristics. We will keep your application on file so that we can consider you for future vacancies and you can always ask to have your details removed from the file. For more details please read our privacy policy. To all recruitment agencies: Agoda does not accept third party resumes. Please do not send resumes to our jobs alias, Agoda employees or any other organization location. Agoda is not responsible for any fees related to unsolicited resumes."
Finance Operations Specialist (Bangkok Based),"Agoda Services Co., Ltd.",Bangkok,Financial Accounting & Reporting,Full time,,,"Finance Operations Specialist (Bangkok Based) Apply Now Bangkok, Thailand About Agoda Agoda is an online travel booking platform for accommodations, flights, and more. We build and deploy cutting-edge technology that connects travelers with more than 3.6 million accommodations globally. Based in Asia and part of Booking Holdings, our 6,000+ employees representing 90+ nationalities foster a work environment rich in diversity, creativity, and collaboration. We innovate through a culture of experimentation and ownership, enhancing the ability for our customers to experience the world. Get to Know our Team: Agoda has taken many great strides in recent years, expanding our reach around the globe as well as our list of travel products. A critical driver to this success has been the team of Agoda Finance. We keep a steady hand on maintaining day-to-day financial operations while also keeping an eye out for future opportunities. Not only do we have the unique role of balancing risk management with continued innovation and growth, we also serve as a means of empowerment for both our team members and those within the company. Having experimentation and data analysis deeply ingrained in our culture, we provide the strategic insights Agoda’s business leaders need to push into new territories in sustainable and scalable ways. We also prioritize career development in Agoda Finance. Every function within the team has a well-defined career track with clear goals and development targets each step of the way. The Opportunity: The individual will have a chance to be part of some of Agoda’s key projects and play a significant role in monitoring and analysis of the financial data involved. The individual will be mainly responsible for reconciliation and validation of data relating to Agoda’s financial operations such as payments, bookings, and receipts, and lead the initiative to design new and enhance existing processes to improve financial data integrity. The role will enable the individual to acquire good understanding of Agoda’s business objectives and operational processes that have been the ingredients of the company’s success. We are looking for an agile learner who is strong in accounting and prepared to work in a fast-paced, high intensity work environment. The individual needs to be able to work in a logical and systematic manner and communicate effectively to various stakeholders. As the company continues to expand and grow, the role may evolve over time. The candidate should be open to additional challenges and responsibilities. In this Role, you’ll get to: Perform financial reconciliations for transactions from various sources; Analyze, interpret and investigate data discrepancies in a methodological approach and assess the financial impact; Coordinate and lead discussion with multiple stakeholders; Be proactive in identifying issues, recognising the patterns of a problem and collabrate with other stakeholders to provide short/medium/long term solutions; Lead the initiative to design new and enhance existing programs and processes in order to ensure the accuracy of data; Prepare ad-hoc reports and analysis. What you’ll Need to Succeed: Bachelor’s Degree in Business, Finance, Accounting or related discipline; Minimum 4 years’ experience in Finance, Accounting or Consulting or a related area Strong Excel skills is a must; Strong problem solving skills; Excellent communication skills and stakeholder management, strong English is a must; Strong analytical skills with the ability to collect, organize and analyse, significant amounts of information with attention to detail and accuracy; Ability to think out of the box; Data driven and process oriented; Adaptable and fast learner who can work independently in a dynamic work environment. Equal Opportunity Employer At Agoda, we pride ourselves on being a company represented by people of all different backgrounds and orientations. We prioritize attracting diverse talent and cultivating an inclusive environment that encourages collaboration and innovation. Employment at Agoda is based solely on a person’s merit and qualifications. We are committed to providing equal employment opportunity regardless of sex, age, race, color, national origin, religion, marital status, pregnancy, sexual orientation, gender identity, disability, citizenship, veteran or military status, and other legally protected characteristics. We will keep your application on file so that we can consider you for future vacancies and you can always ask to have your details removed from the file. For more details please read our privacy policy. To all recruitment agencies: Agoda does not accept third party resumes. Please do not send resumes to our jobs alias, Agoda employees or any other organization location. Agoda is not responsible for any fees related to unsolicited resumes."
Finance Operations Analyst (Bangkok-based),"Agoda Services Co., Ltd.",Bangkok,Financial Accounting & Reporting,Full time,,,"Finance Operations Analyst (Bangkok-based) Apply Now Bangkok, Thailand About Agoda Agoda is an online travel booking platform for accommodations, flights, and more. We build and deploy cutting-edge technology that connects travelers with more than 3.6 million accommodations globally. Based in Asia and part of Booking Holdings, our 6,000+ employees representing 90+ nationalities foster a work environment rich in diversity, creativity, and collaboration. We innovate through a culture of experimentation and ownership, enhancing the ability for our customers to experience the world. Get to Know our Team: Agoda has taken many great strides in recent years, expanding our reach around the globe as well as our list of travel products. A critical driver to this success has been the team of Agoda Finance. We keep a steady hand on maintaining day-to-day financial operations while also keeping an eye out for future opportunities. Not only do we have the unique role of balancing risk management with continued innovation and growth, we also serve as a means of empowerment for both our team members and those within the company. Having experimentation and data analysis deeply ingrained in our culture, we provide the strategic insights Agoda’s business leaders need to push into new territories in sustainable and scalable ways. We also prioritize career development in Agoda Finance. Every function within the team has a well-defined career track with clear goals and development targets each step of the way. The Opportunity: The individual will have a chance to be part of some of Agoda’s key projects and play a significant role in monitoring and analysis of the financial data involved. The individual will be mainly responsible for reconciliation and validation of data relating to Agoda’s financial operations such as payments, bookings, and receipts, and contribute to designing new and enhancing existing processes to improve financial data integrity. In this Role, you’ll get to: Perform financial reconciliations for transactions from various sources; Analyze, interpret and investigate data discrepancies in a methodological approach and prepare reports to various stakeholders; Effectively communicate the result of investigation to relevant stakeholders; Be proactive in identifying issues, recognizing the patterns of a problem and collaborate with other stakeholders to provide short/medium/long term solutions; Contribute to design new and enhance existing programs and processes in order to ensure the accuracy of data; Prepare ad-hoc reports and analysis. What you’ll Need to Succeed: Bachelor’s Degree in Business, Finance, Accounting or related discipline; Minimum 1-2 years’ experience in Finance, Accounting or Consulting or a related area Strong Excel skills is a must; Strong problem solving skills; Excellent communication skills, strong English is a must; Strong analytical skills with the ability to collect, organize and analyze, significant amounts of information with attention to detail and accuracy; Ability to think out of the box; Data driven and process oriented; Adaptable and fast learner who can work independently in a dynamic work environment. Visa sponsorship and relocation for this role would not be provided. #thailand #bangkok Equal Opportunity Employer At Agoda, we pride ourselves on being a company represented by people of all different backgrounds and orientations. We prioritize attracting diverse talent and cultivating an inclusive environment that encourages collaboration and innovation. Employment at Agoda is based solely on a person’s merit and qualifications. We are committed to providing equal employment opportunity regardless of sex, age, race, color, national origin, religion, marital status, pregnancy, sexual orientation, gender identity, disability, citizenship, veteran or military status, and other legally protected characteristics. We will keep your application on file so that we can consider you for future vacancies and you can always ask to have your details removed from the file. For more details please read our privacy policy. To all recruitment agencies: Agoda does not accept third party resumes. Please do not send resumes to our jobs alias, Agoda employees or any other organization location. Agoda is not responsible for any fees related to unsolicited resumes."
Collections Vendor Management Coordinator (Bangkok based),"Agoda Services Co., Ltd.",Bangkok,Financial Accounting & Reporting,Full time,,,"Collections Vendor Management Coordinator (Bangkok based) Apply Now Bangkok, Thailand About Agoda Agoda is an online travel booking platform for accommodations, flights, and more. We build and deploy cutting-edge technology that connects travelers with more than 3.6 million accommodations globally. Based in Asia and part of Booking Holdings, our 6,000+ employees representing 90+ nationalities foster a work environment rich in diversity, creativity, and collaboration. We innovate through a culture of experimentation and ownership, enhancing the ability for our customers to experience the world. Get to Know our Team: Collections function within Credit Risk and Collections team is responsible for the collection from hotel partners for various product offerings. It also provides analytical support on various data requirements and is also responsible for collections MIS and reporting activities. This function manages the end-to-end management of Agoda’s external Debt Collection Affiliates. This team is expanding, and we are looking for Collections Vendor Management Senior Analyst to be based out of Bangkok, Thailand. The Opportunity: Agoda is seeking a Collections Vendor Management Coordinator  to lead and innovate our external debt collection process operations. This is an individual contributor role. In this role, you will play a pivotal part in optimizing collections processes, enhancing our relationships with external debt collectors, and driving financial outcomes. We are looking for a creative and proactive individual who can collaborate effectively with our collections team to achieve outstanding results. In this role, you’ll get to: Become Agoda’s subject matter expert (SME) for our external vendors i.e.  Global Debt Collection Agencies (DCA) and law firms. Coordinate with external vendors and own their end to end operations and efficiency improvements: This includes establishing robust procedures, assignment and withdrawal of accounts, managing payments, and responding to their inquiries. Collaborate with the broader Collections team on cases requiring external vendor involvement and facilitate communication with internal stakeholders Drive vendors to meet collections target and to positively influence Agoda P&L. Contribute with effective ideas to automate manual processes and work with key stakeholders on implementing identified solution. What you’ll Need to Succeed A minimum of 1 year vendor management or coordination related experience is required Candidate with collection background would be preferred. Organized and detailed oriented Strong organizational skills and attention to detail. Approach challenges in a passionate, innovative, and decisive attitude. Ability to work efficiently & independently, and to adapt to a fast-paced working environment. Passionate and a fast learner in line with Agoda values. Ability to problem solve and meet deadlines as agreed. Must be extremely confident, proactive and take personal ownership of task completions. Proficiency in Microsoft Excel SQL knowledge is a plus. This role would be based out of Bangkok, Thailand. #Bangkok #Kualalumour #Manila #Hanoi #Makati #Lahore #Karachi #Delhi  #Mumbai Equal Opportunity Employer At Agoda, we pride ourselves on being a company represented by people of all different backgrounds and orientations. We prioritize attracting diverse talent and cultivating an inclusive environment that encourages collaboration and innovation. Employment at Agoda is based solely on a person’s merit and qualifications. We are committed to providing equal employment opportunity regardless of sex, age, race, color, national origin, religion, marital status, pregnancy, sexual orientation, gender identity, disability, citizenship, veteran or military status, and other legally protected characteristics. We will keep your application on file so that we can consider you for future vacancies and you can always ask to have your details removed from the file. For more details please read our privacy policy. To all recruitment agencies: Agoda does not accept third party resumes. Please do not send resumes to our jobs alias, Agoda employees or any other organization location. Agoda is not responsible for any fees related to unsolicited resumes."
Accounts Payable Officer / Senior Officer (Bangkok based),"Agoda Services Co., Ltd.",Bangkok,Financial Accounting & Reporting,Full time,,,"Accounts Payable Officer / Senior Officer (Bangkok based) Apply Now Bangkok, Thailand About Agoda Agoda is an online travel booking platform for accommodations, flights, and more. We build and deploy cutting-edge technology that connects travelers with more than 3.6 million accommodations globally. Based in Asia and part of Booking Holdings, our 6,000+ employees representing 90+ nationalities foster a work environment rich in diversity, creativity, and collaboration. We innovate through a culture of experimentation and ownership, enhancing the ability for our customers to experience the world. Get to know our team Agoda has taken many great strides in recent years, expanding our reach around the globe as well as our list of travel products. A critical driver to this success has been the team of Agoda Finance. We keep a steady hand on maintaining day-to-day financial operations while also keeping an eye out for future opportunities. Not only do we have the unique role of balancing risk management with continued innovation and growth, we’re also serve as a means of empowerment for both our team members and those within the company. Having experimentation and data analysis deeply ingrained in our culture, we provide the strategic insights Agoda’s business leaders need to push into new territories in sustainable and scalable ways. We also prioritize career development in Agoda Finance. Every function within the team has a well-defined career track with clear goals and development targets each step of the way. Job Description Perform day-to-day Accounts Payable financial and related accounting activities e.g., making payment to supplier, ensure all financial transactions are accurate, executed and recorded on time Perform month end closing activities e.g., monthly reconciliation of Accounts Payable related accounts including overall analyze to detect unusual items and propose resolution on discrepancies/outstanding (If any) Monitor accounting, associated system and procedures working properly and comply with internal controls, regulations, accounting principles and standards Provide necessary support to projects/initiatives/process enhancement to ensure that they are completed on-time with quality results Provide support transactions processing particularly for more complexity with supervisor’s advisement Ensure that unusual items or cases are brought up for discussion appropriately and resolved within the deadline with consultation from Supervisor Proactive partnering, ensure fairly support stakeholders within Finance and outside of Finance Support team to deliver Ad Hoc request as needed What you’ll need to succeed Bachelor’s degree in accounting or related field 1-2 years’ experience in Accounts Payable Accounting or related field Strong Interpersonal skill, problem solving, prioritization, proactive handling, and teamwork with ability to meet deadline Proficient in MS Office Application Dynamic and able to adapt to a fast-paced environment with growth mindset Team working skills – ability to collaborate, influence and mediate effectively with other teams both within and outside of Finance Energetic, initiative with good communication skills in Thai and English It’s great if you have Proficient ERP Software (Oracle is preferable) Accounting experience in online travel agency business #Bangkok #Thailand Equal Opportunity Employer At Agoda, we pride ourselves on being a company represented by people of all different backgrounds and orientations. We prioritize attracting diverse talent and cultivating an inclusive environment that encourages collaboration and innovation. Employment at Agoda is based solely on a person’s merit and qualifications. We are committed to providing equal employment opportunity regardless of sex, age, race, color, national origin, religion, marital status, pregnancy, sexual orientation, gender identity, disability, citizenship, veteran or military status, and other legally protected characteristics. We will keep your application on file so that we can consider you for future vacancies and you can always ask to have your details removed from the file. For more details please read our privacy policy. To all recruitment agencies: Agoda does not accept third party resumes. Please do not send resumes to our jobs alias, Agoda employees or any other organization location. Agoda is not responsible for any fees related to unsolicited resumes."
