Jobtitle,Company,Location,Job Position,Salary Min,Salary Max,Job Description
Finance Officer (True Money),"Ascend Group Co., Ltd.","Din Daeng, Bangkok",Financial Accounting & Reporting,Full time,,,"RESPONSIBILITY Reconcile transaction customers payment via wallet and non-wallet. Prepare Payment and pay (Auto, Manual Payment) to Biller, Merchant True Group, non-True Group. Check and Adjust transactions. Calculate and confirm commission, fee, and provide Memo to accounting, partner, merchants. Handle refund issue. Support and solve problems for customers, merchants, bank. Support work as assignment. REQUIREMENT Bachelor’s degree or higher degree related in Finance, accounting, MBA Minimum 0-2 years working experiences in Finance operation of telco business Finance & Banking Institute preferable in cash management or product development experience Payment agent business"
Bar Supervisor,"High Season Resort Co., Ltd.","Ko Kut, Trat",Taxation,Full time,,,"Last Updated : 13.01.2024 | Viewers 5,353 Salary : เงินเดือน 15,001 - 20,000 (THB) Types of employees : ประเภทงาน Full-time เต็มเวลา Area : ปฎิบัติงานที่จังหวัด Education : การศึกษา Vocational Certificate ปวช Experience : ประสบการณ์การทำงาน 3 Year (ปี) Gender : เพศ Male/Female ชาย/หญิง Age : อายุ Non-Specific ไม่จำกัดอายุ Unit : จำนวนรับ 1 อัตรา New Graduated : นักศึกษาจบใหม่ No ไม่รับพิจารณา Foreigner : ชาวต่างชาติ No ไม่รับพิจารณา Disabled : ผู้พิการ No ไม่รับพิจารณา Night shift : ตำแหน่งงานกะดึก No ไม่ใช่ Job Qualifications ข้อกำหนด 1.เพศ ช/ญ 2.วุฒิ ปวช.ขึ้นไป 3.มีประสบการณ์ในตำแหน่ง 3 ปีขึ้นไป 4.สามารถสื่อสารภาษาอังกฤษได้ Contact ข้อมูลติดต่อ - (ฝ่ายทรัพยากรบุคคล) 117 หมู่ 2 ตำบลเกาะกูด อำเภอเกาะกูด จังหวัดตราด 23000 เว็บไซต์ : www.highseasonresort.com/ อีเมล์ : เบอร์โทรศัพท์ :"
Pre-school Teachers,Denla Trilingual School,Bangkok,Business Services & Corporate Advisory,Full time,,,"Pre-school Teachers Posted
 
 8 hours ago We are looking for two motivated preschool teachers. For these positions you must be: - a qualified teacher with a BA in Education or a graduate in an education qualification that took at least one year of full-time study (examples include a PGCEi or its equivalent), - a native English speaker, - an experienced teacher, - a dynamic educator who uses play-based learning techniques, - a team player, ready to share and contribute with others. The benefits we offer include: - a monthly salary between 80,000 and 97,000 Baht per month, depending on education and experience, - a 10,000 Baht per month housing allowance (Thus, total package of 90,000 to 107,000), - gratuity of 1 month's salary per year of service payable at the end of the contract, - annual economy class flight allowance – up to 50,000 per year, - Professional Development fund – up to 30,000 per year, - health insurance, - paid holidays – 13 weeks per year. When applying for this position please provide: - a full CV, - a copy of the ID page of your passport. Send Resume"
พนักงานบัญชี (หญิง) ด่วน!! พัทยา,บริษัท เจมส์ แกลอรี่ พัทยา จำกัด,Chon Buri,Taxation,Full time,,,"สถานที่ทำงาน : พัทยาเหนือ, ชลบุรี - 20150 Thailand อัตราค่าจ้าง : ไม่ระบุ(เงินเดือน) ตำแหน่ง พนักงานบัญชี (หญิง) คุณสมบัติ *วุฒิการศึกษาระดับปริญญาตรี สาขาการบัญชี อายุไม่เกิน 45 ปี ไม่จำกัดเพศ *มีประสบการณ์ในการทำบัญชีอย่างน้อย 2 ปี เช่น จัดทำภาษีซื้อ-ขาย / จัดทำภาษี ภงด. 3 ภงด.53 / ลงบัญชีค่าใช้จ่ายประจำวัน / จัดทำสต็อคสินค้าคงเหลือ / ยื่นภาษี ภพ.30 ส่งสรรพากรทางอินเตอร์เน็ต * อัตราเงินเดือนตามตกลง สวัสดิการ ค่าอาหาร, ค่ารักษาพยาบาล, เบี้ยเลี้ยง สมัครได้ด้วยตนเองที่ บริษัท เจมส์ แกลอรี่พัทยา จำกัด เลขที่ 555 หมู่ 6 ถ.พัทยาเหนือ ต.นาเกลือ อ.บางละมุง จ.ชลบุรี 20150 โทร. 085-1113979 ทุกวันจันทร์ – วันศุกร์ เวลา 13.00 น. – 15.30 น. ยกเว้นวันนักขัตฤกษ์ หรือส่งประวัติมาทาง E-mail : gemspty@gemsgroup.th.com หรือสมัครผ่านหน้าเว็บ jobpattaya เอกสารที่ต้องใช้ในการสมัครงาน ผู้สมัครทุกท่านที่สนใจสมัครงานในตำแหน่งงานใดๆ กับบริษัท กรุณาแนบเอกสารการสมัครงาน มีรายการดังนี้ คำแนะนำ โปรดเซ็นต์ชื่อรับรองสำเนาถูกต้องในเอกสารทุกใบ และเขียนกำกับว่าใช้ในการสมัครงานเท่านั้น 1. สำเนาบัตรประชาชน ทะเบียนบ้าน วุฒิการศึกษา ใบผ่านการเกณฑ์ทหาร (จำเป็นต้องนำไป) 2. รูปถ่าย แนะนำ 1 นิ้ว 2 รูป (จำเป็นต้องนำไปครับ) 3. สำเนาเอกสารราชการต่างๆ เช่น ใบเปลี่ยนชื่อ- สกุล / ใบผ่านการเกณฑ์ทหาร ฯ (ถ้ามี) 4. สำเนาหนังสือรับรองต่างๆ / สำเนาใบขับขี่ (ถ้างานนั้นเกี่ยวกับการขับรถ) 5. Slip เงินเดือนจากบริษัทปัจจุบัน หรือบริษัทสุดท้ายที่ท่านทำงาน (ถ้ามี) ระดับการศึกษา Qualification : ปริญญาตรี ขึ้นไป เว็บไซต์ Website : http://www.gems-gallery.com บริษัท เจมส์ แกลอรี่ พัทยา จำกัด ที่อยู่ที่ติดต่อ 555 หมู่ที่ 6 ถ.พัทยาเหนือ ต.นาเกลือ บางละมุง, ชลบุรี - 20150 Thailand » (View)มีตำแหน่งว่าง 3 ตำแหน่งงาน ผู้รับสมัคร : ฝ่ายบุคคล ( จ.- ศ. 13.00-15.30 น.) โทรศัพท์ : 085-1113979 แฟกซ์ : - เว็บไซต์ : http://www.gems-gallery.com จำนวนลูกจ้างประมาณ : 300 - 500 คน สถานะกิจการ : เอกชน ประเภทธกิจการ : อัญมณี / เครื่องประดับ Gems Gallery Lifetime Guarantee Since 1987 Today Gems Gallery is situated in four major cities, Bangkok, Chiangmai, Phuket and Pattaya. Each branch is in itself a top tourist destination, and all make it easier for visitors to choose and own beautiful gems. No matter which branch you visit, you can be sure that you will get only the best in products and services. บริษัท เจมส์ แกลอรี่ พัทยา จำกัด 555 หมู่ที่ 6 ถ.พัทยาเหนือ ต.นาเกลือ อ.บางละมุง จ.ชลบุรี 20150 โทร. 038-371-222 ต่อ 134-135 , 085-1113982 ฝ่ายบุคคล E-mail : gemspty@gemsgroup.th.com บริษัท ลา แกลเลอเรีย จำกัด(บริษัทในเครือเจมส์ แกลอรี่ พัทยา) เลขที่ 333 หมู่ที่ 3 ต.หนองปลาไหล อ.บางละมุง จ.ชลบุรี โทร. 038-196-333 E-mail : admin@lagalleria.co.th บริษัท เฮิร์บ แอนด์ เฮลท์ แกลเลอรี่ จำกัด(บริษัทในเครือเจมส์ แกลอรี่ พัทยา) เลขที่ 555 หมู่ที่ 3 ต.หนองปลาไหล อ.บางละมุง จ.ชลบุรี โทร. 038-195-999 E-mail: info.pty@herbandhealthgallery.com"
Senior Accountant,iSanook Hotels & Resorts,"Hua Hin, Prachuap Khiri Khan",Business Services & Corporate Advisory,Full time,,,"Last Updated : 10.01.2024 | Viewers 9 Salary : เงินเดือน N/A (THB) Types of employees : ประเภทงาน Full-time เต็มเวลา Area : ปฎิบัติงานที่จังหวัด Education : การศึกษา Bachelor's Degree ปริญญาตรี Experience : ประสบการณ์การทำงาน 2 Year (ปี) Gender : เพศ Male/Female ชาย/หญิง Age : อายุ Not over 50 years old อายุไม่เกิน 50 ปี Unit : จำนวนรับ 1 อัตรา New Graduated : นักศึกษาจบใหม่ No ไม่รับพิจารณา Foreigner : ชาวต่างชาติ Yes รับพิจารณา Disabled : ผู้พิการ No ไม่รับพิจารณา Night shift : ตำแหน่งงานกะดึก No ไม่ใช่ Job Qualifications ข้อกำหนด iSanook Resort & Suites Hua Hin THAI ONLY 1. Proven experience as an Accounting Supervisor or senior accountant 2. Thorough knowledge of basic accounting procedures 3. In-depth understanding of Generally Accepted Accounting Principles (GAAP) 4. Awareness of business trends 5. Familiarity with financial accounting statements 6. Experience with general ledger functions and the month-end/year-end close process 7. Hands-on experience with accounting software packages. 8. Advanced MS Excel skills including Vlookups and pivot tables 9. Accuracy and attention to detail 10. Aptitude for numbers and quantitative skills Job Details รายละเอียดงาน iSanook Resort & Suites Hua Hin To oversee general accounting operations by controlling and verifying our financial transactions Welfare สวัสดิการ 1. 6 days off per month 2. Bonus 3. Uniform provided (T-Shirts) 4. Health Insurance 5. SSO 6. Duty Meal Contact ข้อมูลติดต่อ ฝ่าย HR (-) 118,118/8 ตรอกสองพระ ถนนสี่พระยา แขวงมหาพฤฒาราม
เขตบางรัก กรุงเทพฯ เว็บไซต์ : www.i-sanook.com อีเมล์ : เบอร์โทรศัพท์ :"
พนักงานบัญชี(หญิง) ด่วน!!! พัทยา,บริษัท บาลี ฮาย วิว จำกัด,Chon Buri,Taxation,Full time,,,"สถานที่ทำงาน : พัทยาใต้ แหลมบาลีฮาย, ชลบุรี - 20150 Thailand อัตราค่าจ้าง : 25,000.00 - 30,000 หรือ ตามตกลง รับสมัครพนักงานบัญชี (ทำงาน จ.-ศ. หยุด ส.-อา.) เงินเดือน:  25,000-30,000 บาท หรือตามประสบการณ์ และการตกลง พนักงานบัญชี 1. เพศ หญิง อายุ 21 - 35 ปี 2. วุฒิการศึกษาระดับ ปริญญาตรี สาขาบัญชี 3. มีประสบการณ์ด้านบัญชี 4. มีความรู้และสามารถบันทึก ตรวจสอบบัญชีในโปรแกรมสำเร็จรูปได้ดี 5. มีความละเอียด รอบคอบ สามารถแก้ไขปัญหาเฉพาะหน้าได้ดี มีความคล่องตัวสูง ลักษณะงาน 1. จัดทำงบการเงิน งบกระแสเงินสดรายเดือน/ รายปี 2. สามารถวิเคราะห์ งบการเงิน และปิดงบได้เป็นอย่างดี 3. สามารถควบคุมจัดหาแหล่งเงินทุน และบริหารการรับจ่ายเงินได้เป็นอย่างดี 4. ร่วมวางแผนการจ่ายภาษีตามแผนงานของบริษัทฯ 5. พัฒนาความรู้ ความสามารถของบุคคลากรในแผนก 6. ปฏิบัติงาน 5 วัน / สัปดาห์ ( จันทร์ –ศุกร์) สวัสดิการ ประกันสังคม สนใจสมัครงาน บริษัท บาลี ฮาย วิว จำกัด สอบถามเพิ่มเติมติดต่อ หมายเลขโทรศัพท์ 038-420-170 หรือติดต่อ คุณ จุฑารัตน์ ธนภัทร์กรันย์ Tel: 098-494-6532 (จ.-ศ. 9.00-17.00น.) สมัครงานส่งประวัติพร้อมรูปถ่ายมาที่ E-mail : jutharat.t@balihaiview.com เอกสารที่ต้องใช้ในการสมัครงาน ผู้สมัครทุกท่านที่สนใจสมัครงานในตำแหน่งงานใดๆ กับบริษัท กรุณาแนบเอกสารการสมัครงาน มีรายการดังนี้ คำแนะนำ โปรดเซ็นต์ชื่อรับรองสำเนาถูกต้องในเอกสารทุกใบ และเขียนกำกับว่าใช้ในการสมัครงานเท่านั้น 1. สำเนาบัตรประชาชน ทะเบียนบ้าน วุฒิการศึกษา ใบผ่านการเกณฑ์ทหาร (จำเป็นต้องนำไป) 2. รูปถ่าย แนะนำ 1 นิ้ว 2 รูป (จำเป็นต้องนำไปครับ) 3. สำเนาเอกสารราชการต่างๆ เช่น ใบเปลี่ยนชื่อ- สกุล / ใบผ่านการเกณฑ์ทหาร ฯ (ถ้ามี) 4. สำเนาหนังสือรับรองต่างๆ / สำเนาใบขับขี่ (ถ้างานนั้นเกี่ยวกับการขับรถ) 5. Slip เงินเดือนจากบริษัทปัจจุบัน หรือบริษัทสุดท้ายที่ท่านทำงาน (ถ้ามี) ระดับการศึกษา Qualification : ปริญญาตรี ขึ้นไป เว็บไซต์ Website : https://www.balihaiview.com/ บริษัท บาลี ฮาย วิว จำกัด ที่อยู่ที่ติดต่อ 551/1 ม. 10 ต.หนองปรือ บางละมุง, ชลบุรี - 20150 Thailand » (View)มีตำแหน่งว่าง 1 ตำแหน่งงาน ผู้รับสมัคร : จุฑารัตน์ ธนภัทร์กรันย์ โทรศัพท์ : 098-494-6532 แฟกซ์ : - เว็บไซต์ : https://www.balihaiview.com/ ประเภทธกิจการ : ท่องเที่ยว / พิพิธภัณฑ์ / โรงละคร บาลีฮายวิว บิซิเนสเซ็นเตอร์ เปิดให้บริการสำนักงานให้เช่าครบวงจร สะดวกสบาย หรูหรา และมีสาธารณูปโภคครบครัน  ซึ่งจะช่วยให้คุณเริ่มต้นการประกอบธุรกิจได้อย่างมั่นใจและประสบความสำเร็จตามเป้าหมาย ไม่ว่าจะเป็นการใช้บริการห้องประชุมเพียงครั้งเดียว หรือต้องการสถานที่ทำงานส่วนตัวสำหรับตัวคุณเองหรือทีมงานของคุณก็ตาม เรามุ่งมั่นที่จะเป็นหนึ่งในสำนักงานที่ดีที่สุดในเมืองพัทยา โดยสร้างวัฒนธรรมทางธุรกิจที่แวดล้อมไปด้วยเทคโนโลยีและโครงสร้างพื้นฐานที่เอื้อต่อการทำงานร่วมกันและช่วยให้การทำงานในสภาพแวดล้อมที่ดี มีประสิทธิภาพและเกิดประโยชน์สูงสุด ให้คุณได้โฟกัสกับการประกอบธุรกิจอย่างได้อย่างมืออาชีพ สำนักงานของเราตั้งอยู่อยู่ใจกลางเมืองพัทยาที่ไม่เคยหลับไหล ท่าเทียบเรือแหลมบาลีฮาย"
Accountant (BAR) CERAMICS - Don Mueang,SCG,Bangkok,Taxation,Full time,,,เนื้องานโดยย่อ: หน้าที่ความรับผิดชอบ: Analyzing and preparing managerial monthly and annual reports. Prepare financial performance monthly and annual report. Prepare and analyze both marketing and administrative expenses. Prepare other report as assigned. คุณสมบัติ: Bachelor's Degree in Accounting at least 2.7 GPA TOEIC at least 550/IELTS at least 4.0/TOEFL at least 31/BULATS at least 40 1-5 years of experiences in accounting (Fresh Graduates Are Welcome) Strong Knowledge in Accounting Standards. Logical Thinking and Good Communication. Ability to work high-pressured environment. Proactive & Accountability.
Cluster General Ledger Supervisor,Luxury Hotels & Resorts (Thailand) Ltd.,Bangkok,Financial Accounting & Reporting,Full time,,,"POSITION SUMMARY Check figures, postings, and documents for accuracy. Organize, secure, and maintain all files, records, cash and cash equivalents in accordance with policies and procedures. Record, store, access, and/or analyze computerized financial information. Classify, code, and summarize numerical and financial data to compile and keep financial records, using journals, ledgers, and/or computers. Prepare, maintain, audit, and distribute statistical, financial, accounting, auditing, or payroll reports and tables. Complete period-end closing procedures and reports as specified. Prepare, review, reconcile, and issue bills, invoices, and account statements according to company procedures. Follow-up and resolve past due accounts and vendor invoices until payment in full is received or resolved. Coordinate tasks and work with other departments; serve as a departmental role model or mentor; assign and ensure work tasks are completed on time and that they meet appropriate quality standards. Report work related accidents, or other injuries immediately upon occurrence to manager/supervisor. Follow all company policies and procedures; ensure uniform and personal appearance are clean and professional; maintain confidentiality of proprietary information; protect company assets. Speak with others using clear and professional language; prepare and review written documents accurately and completely; answer telephones using appropriate etiquette. Develop and maintain positive working relationships with others; support team to reach common goals; listen and respond appropriately to the concerns of other employees. Move, lift, carry, push, pull, and place objects weighing less than or equal to 10 pounds without assistance. Perform other reasonable job duties as requested by Supervisors. Marriott International is an equal opportunity employer. We believe in hiring a diverse workforce and sustaining an inclusive, people-first culture. We are committed to non-discrimination on any protected basis, such as disability and veteran status, or any other basis covered under applicable law. Be begin belong become JW Marriott is part of Marriott International's luxury portfolio and consists of more than 100 beautiful properties in gateway cities and distinctive resort locations around the world. JW believes our associates come first. Because if you’re happy, our guests will be happy. JW Marriott associates are confident, innovative, genuine, intuitive, and carry on the legacy of the brand’s namesake and company founder, J.Willard Marriott. Our hotels offer a work experience unlike any other, where you’ll be part of a community and enjoy true camaraderie with a diverse group of co-workers. JW creates opportunities for training, development, recognition and most importantly, a place where you can pursue your passions in a luxury environment with a focus on holistic well-being. Treating guests exceptionally starts with the way we take care of our associates. That’s The JW Treatment™. In joining JW Marriott, you join a portfolio of brands with Marriott International. Be where you can do your best work,​ begin your purpose, belong to an amazing global​ team, and become the best version of you."
Account Receiveable Officer,"Krongthong Villa Co., Ltd.",Chon Buri,Business Services & Corporate Advisory,Full time,,,"Last Updated : 09.01.2024 | Viewers 2,444 Salary : เงินเดือน N/A (THB) Types of employees : ประเภทงาน Full-time เต็มเวลา Area : ปฎิบัติงานที่จังหวัด Education : การศึกษา Higher Vocational Certificate ปวส Experience : ประสบการณ์การทำงาน 1 Year (ปี) Gender : เพศ Male/Female ชาย/หญิง Age : อายุ Non-Specific ไม่จำกัดอายุ Unit : จำนวนรับ 1 อัตรา New Graduated : นักศึกษาจบใหม่ No ไม่รับพิจารณา Foreigner : ชาวต่างชาติ No ไม่รับพิจารณา Disabled : ผู้พิการ No ไม่รับพิจารณา Night shift : ตำแหน่งงานกะดึก No ไม่ใช่ Job Qualifications ข้อกำหนด 1. อายุไม่เกิน 30 ปี 2. ปวส.-ปริญญาตรี การบัญชี 3. มีประสบการณ์งานบัญชีโรงแรม จะพิจารณาเป็นพิเศษ 4. ขยัน ซื่อสัตย์ อดทน 5. มีความละเอีบด รอบคอบ Job Details รายละเอียดงาน ลงบัญชีด้านรับ รายได้ โดยใช้โปรแกรมสำเร็จรูป Contact ข้อมูลติดต่อ Natthiya Kaewraksa (Human Resources Manager) Office : At Mind Group of Hotel and Residence
399/3-10 Moo 9, Tambol Nongprue, Amphur Banglamung, Chonburi 20150
(Please send CV to our email and kindly fill your expected salary .) เว็บไซต์ : www.atmindgroup.com.com อีเมล์ : เบอร์โทรศัพท์ :"
