Jobtitle,Company,Location,Job Position,Salary Min,Salary Max,Job Description
DATA ANALYST,Puraido Co Ltd,"Vadhana, Bangkok","Mathematics, Statistics & Information Sciences",Full time,,,"SALARY: THB 20,000 – 40,000 We are seeking a skilled and driven Data Analyst to become a valuable member of our dynamic team. As a Data Analyst, you will play a pivotal role in driving data-driven decision-making across various departments. You will work closely with stakeholders to gather requirements, analyze data, and present findings that will guide strategic business decisions. Daily Responsibilities: Conduct daily performance analyses across MID's, banks, gateways, etc. Identify and communicate any issues requiring management attention. Perform exploratory investigations using data tools such as Power BI, Redshift, and PostgresDB. Collaborate with the Data Science team to review and contribute to dashboard development. Generate ad-hoc Excel reports as needed. Manage alerts and handle manual data entry tasks. Weekly Responsibilities: Prepare marketing reports and evaluations, collaborating closely with the Media Team. Analyze weekly performance data across MID's, banks, gateways, etc. Monthly Responsibilities: Provide strategic recommendations to the product or data team for future developments. Generate monthly reports on financial performance related to business operations. Create monthly reports on risk assessments, chargebacks, alerts, etc. Compile monthly reports on marketing efforts, including costs and Return on Ad Spend (ROAS)."
Technology & Technical Services Manager- Feed Additives  based in BKK...,Cargill Group Thailand (กลุ่มบริษัทคาร์กิลล์ ประเทศไทย),"Pathum Wan, Bangkok",Biological & Biomedical Sciences,Full time,,,"JOB PURPOSE AND IMPACT The Technology & Technical Services Manager , is a technical expert responsible for providing advice and insights to category customers while helping the business achieve growth targets. In this role, you will understand customer strategies and needs and help them to improve their results and reach and exceed their goals through product solutions and services. You will also identify new business development opportunities within existing customers or with new opportunities, find and propose solutions, lead projects, communicate and train customers. You will be a trusted advisor to customers and provide strategic and technical direction for account managers. The role will focus on providing technical support to South Asia countries: India, Bangladesh, Sri Lanka, Pakistan. KEY ACCOUNTABILITIES Partner with the customer's research and development team for category's customers to understand the business strategy and anticipate needs of the customer. Participate in technical involvement in customer contract negotiation, quarterly meetings, propose strategy, positioning and value proposition. Collaborate with commercial department on providing product, application, ingredient, processing expertise and training. Act as the technical link with marketing and technology team within research and development functions working directly with other functions to assess opportunities for improvement and provide advice and consultation. Deploy the category strategy and ensures all applicable teams are in line to build overall value for the category. Constantly expand knowledge on customers, the application and markets to create new innovation ideas for new projects. Assess performance against key criteria for customers with the most significant impact at the business level and grows incremental contribution margin to meet agreed targets. Independently handle complex issues with minimal supervision, while escalating only the most complex issues to appropriate staff. Other duties as assigned MINIMUM QUALIFICATIONS Bachelor’s degree in a related field or equivalent experience Working knowledge of feed additives, with specific focus on phytogenic (e.g. essential oils, plant extracts), pre/pro/postbiotics, mycotoxin binders, organic acids, enzymes and antioxidants Two or more years experience translating customer or industry needs into commercial solutions Minimum of four years of related work experience Other minimum qualifications may apply Fluent in English communication skills are speaking, listening, writing and reading PREFERRED QUALIFICATIONS Master's degree or other post-secondary degree Action oriented with emotional intelligence, energetic, good influencing skills Understanding of production technologies used for final application Working knowledge of food safety processes and requirements Understanding of livestock and regulatory requirements relevant to feed additives categories KEY BEHAVIORS Plan and prioritize work to meet commitments aligned with organizational goals. Hold self and others accountable to meet commitments. Make sense of complex, high-quantity, and sometimes contradictory, information to effectively solve problems. SKILLS AND EXPERIENCES TO BE GAINED Strong written and verbal communication skills Ability to work cross-functionally in a global and matrixed environment Ability to balance needs with capabilities while meeting needed customer specifications"
R&D Assistant Manager (Ayutthaya),Charoen Pokphand Foods Public Company Limited,Ayutthaya,Food Technology & Safety,Full time,,,"Job Descriptions: A role of Product Development Manager /Deputy Director is responsible to drive growth, efficiency, and quality through leading, championing, and executing of product development process and Technology programs and projects through the development of new products, raw materials, and processes. This position will also serve as a technical subject matter expert and provide business technical guidance, both tactical and strategic. Main Responsibilities: Responsible for Sauce and Seasoned Food. Initiate R&D innovation which results in the development of new products to support marketing program/ promotion to deliver 100% customer satisfaction and achieve company’s business goals. Lead new product development projects from concept to full launch which includes but not limited to developing product recipe, ingredients, sourcing suppliers, approving suppliers, selecting equipment, developing ops procedure and manuals. Collaborate and lead cross functional team to reach project objectives including but not limited to Marketing, Operations, Engineering, Finance, Purchasing, and QA. Able to manage multiple projects and priorities, and work independently. Maintain good working relationship and coordination with Operations team, Finance team and Supply Chain Management team with a view to ensuring proper implementation of new products consistent with the company’s short and long terms sales and profit growth objectives. Applies basic food science knowledge in ingredient functionality and process technology to develop new or improve existing products. Monitor and follow up performance of new products launched both sales and quality, anticipates and analyses causes affecting performance, and provide recommendation to Management and Operations to improve its performance. Work with Operation, Finance and Purchasing team to conduct value analysis and ensure favorable Cost of Goods ratio to sales through cost implement project. Continue to track competitor and pricing analysis and try to position our product at the accessible price to consumers. Prepare related reports on regular basis Weekly, Monthly, Quarterly and Annually to R&D Director, Management and Operations Team Responsible for pre & post analysis of all new products launch and report to R&D Director, Management and Operations Team Demonstrates ability to understand and lead application of consumer research and experimental design (taste test verification) Show good communication skills both verbal and written, including timely and accurate documentation of work cascading to related parties to launch new products effectively. Foster and build a learning organization based on R&D talent and recognition. Own and drive continuous improvement mind-set and culture . Job Specifications: Experience in food innovation or new product development plus solid marketing knowledge. Bachelor’s degree or equivalent in Food Science, Technology, Food Engineering, or related technical fields. Passionate for Food Development Strong knowledge of product development from bench top to full scale production. Prior experience must include design of experiments and functionality of raw materials. Demonstrated excellence in project management and capability to lead cross functional projects. Strong ability to work cross functionally with people in other disciplines and/or business areas. Statistical analysis knowledge Ability to manage multiple tasks, good hands-on skills and fast actions. Strong in innovative, Drive for result, familiar in fast faced working environment. Good English communication skills, proficiency in English communication and presentation skills. Stage gate process experience"
QA & Regulatory Officer,"Central Watson Co., Ltd.","Khlong Toei, Bangkok",Laboratory & Technical Services,Full time,,,"Key Responsibilities Support QA & Regulation team. Work with TFDA for product registration, license application & renewal. QA control according to Group QA guideline and maintain factories audit. OB product formulation validating with TFDA announcement and Group guideline. Complaints management for OB quality issues. CSR functional support. Qualifications Bachelor ‘s degree in Cosmetics Science or Chemical Science Minimum 2 years of related experiment for Details, patient & Calm / Fresh Graduate are also welcome Able to work with government style, multitasking and flexible Good science knowledge while have opened commercial mind Good command of spoken and written English Prefer to work with own car (Driver's license card) Expert in Microsoft Office (Excel, Word, Power Point)"
Quality Assurance Specialist (Food Chemical / Rayong),International Flavours & Fragrances (Thailand) Ltd.,Rayong,Chemistry & Physics,Full time,,,"It’s an exciting time to join our newly combined organization and become part of the New IFF! We serve a large variety of end markets and our products can be found in thousands of consumer products around the world. These include Animal Nutrition, Biorefinery, Dietary Supplements, Beverage, Home Care, Microbial Control, Perfumery, Food, Personal Care, Pharma. We are looking for a dedicated individual to join our team as a Quality Assurance Specialist . This position is based in Thailand and report to Quality Manager. Your Focus As Quality Assurance Specialist, you perform quality assurance functions including QC record or batch record review, product release, investigations, waivers, audit support and customer complaints. How You Will Contribute 1. Quality Management System Can perform all responsibilities associated with Quality Assurance System Develop and evaluate new or revised procedures using methodology and in-depth understanding of all procedures in the QA system, Ensure documentation and records are maintained according to plant procedures and the quality system Support associated with Quality Assurance System ISO 9001, FSSC 22000,cGMP, HACCP and EXCiPACT. Monitor plant KPI. Customer Audit Support - Compile quality and manufacturing records and conduct complete batch review for customer audits. Respond to related audit findings; Customer complaints - Provide support as needed to document, track and maintain customer complaints in plant and sale force complaint systems. Contact customer, lead investigations, determine root cause and corrective or preventive action.  Follow up with customer and respond to customer in writing.  Summarize and communicate results to Sales and plant. 2. cGMP, HACCP and FSSC22000 cGMP – Monitor cGMP control program in plant. HACCP - Establish HACCP Program and evaluate performance of Food safety system, validation and verification coordinator such as CCP, cleaning, process etc. Support Food Safety and Quality recognize activity. 3. Quality Assurance Review Batch record, in-process record, quality testing results prior release. Represent quality on plant business point teams, quality improvement teams and other meetings to address quality issues and provide QA perspective.  Work with engineers, operators and other team members to complete projects. Ensure all testing, reporting and product release is in alignment with quality system. Ensure documentation and records are maintained according to plant procedures and the quality system. Define and optimize quality assurance procedures to maximize efficiency while maintaining high compliance to standards, train personnel as necessary. Follow up all nonconforming product or material, process deviation corrective and preventive action. Recall coordinator, support quality manager. Right First Time Report - Calculate and report Right First-Time quality figures to plant and divisional personnel. Provide Monthly report, product or process capability statistical report. Ensure all activity and product quality conform with both of Thai and customer’s country regulation Comply with external and internal requirements and regulations (OSHA, cGMP, HACCP, ISO 9001, FSSC 22000 and EXCiPACT etc). What will you need to be successful Minimum Degree with Bachelor of Science Degree in Food technology, Chemical technology, Chemical Engineering, Microbiology, or related fields of study or equivalent combination of education and experience. 5 - 7 years’ experience in Quality& Food Safety system management, analytical, quality control in Food Manufacturing or Pharmaceutical. Experience with basic laboratory equipment and analytical testing procedures. Experience with Quality System management ISO 9001, cGMP & HACCP, FSSC 22000, pharmaceutical quality management and EXCiPACT is preferred. Excellent computer skills and software knowledge, including proficiency in programs such SAP, Microsoft Office. Formal statistical training and demonstrated ability to apply statistical techniques to laboratory methods and plant processes. Demonstrated ability to apply chemistry concepts to solve problems. Knowledge of QC techniques and experience with ISO9001, cGMP & HACCP, FSSC 22000, EXCiPACT and USP quality requirements relative to pharmaceutical excipients and food additives. Highly organized and self-motivated. Ability to work in a fast-paced environment while maintaining quality requirements and meeting deadlines. Excellent interpersonal skills.  A strong team player. Strong oral and written English communication skills. Ability to effectively communicate at various levels of the organization, with demonstrated attitude of respect towards others. Overtime and occasional weekend work as required to complete testing and projects in accordance with business and customer demands. IFF is an Equal Opportunity Employer. At IFF, we believe that your uniqueness unleashes our potential.  We value the diverse mosaic of the ethnicity, national origin, race, age, sex or veteran status. We strive for inclusive workplace that allows each of our colleagues to bring their authentic self to work regardless of their religion, gender identity & expression, sexual orientation, or disability. Visit IFF.com/careers/workplace-diversity-and-inclusion to learn more"
นักวิชาการสิ่งแวดล้อม,"Air Save Co., Ltd.","Saphan Sung, Bangkok","Environmental, Earth & Geosciences",Full time,,,1. วุฒิการศึกษาระดับปริญญาตรีขึ้นไป สาขาด้านสิ่งแวดล้อมหรือที่เกี่ยวข้อง 2. ประสบการณ์ทำงาน 3 ปีขึ้นไปพิจารณาเป็นพิเศษ 3. สามารถใช้งานโปรแกรม Microsoft office 4. ความรู้ทางด้านภาษาอังกฤษอยู่ในเกณฑ์สามารถใช้งานได้ 5. มีความมุ่งมั่น เพื่อให้งานสำเร็จลุล่วงด้วยดี
Sales Supervisor / Sales Officer - Food product (Retail Market),"Thai Nippon Foods Co., Ltd.","Pathum Wan, Bangkok",Food Technology & Safety,Full time,,,"อัตราเงินเดือน: 25,000 - 35,000 บาทต่อเดือน รายละเอียดงาน เป็นผู้นำทีมในฐานะหัวหน้างาน รับผิดชอบตลาดค้าปลีก FMCG (กลุ่มธุรกิจสินค้าอุปโภคบริโภค) ขยายตลาดตามประสบการณ์เดิม ติดตามความต้องการทั้งหมดและการเจรจาครอบคลุมถึงความรับผิดชอบของลูกค้า ประสานงานระหว่างทีมขายและส่วนที่เกี่ยวข้องเพื่อให้งานเป็นไปอย่างราบรื่น (เช่น RD, ACC, แผนวางแผน, แผนกคลังสินค้า ฯลฯ) วิจัยตลาดและตลาดลูกค้าเพื่อสร้างแนวคิดใหม่ของ NPD การควบคุมสต็อคสินค้า การร้องขอการผลิต (ตรวจสอบการวางแผน) และหลีกเลี่ยงสินค้าหมดสต๊อก สนับสนุนและปฏิบัติตามคำสั่งผู้บังคับบัญชา คุณสมบัติผู้สมัคร วุฒิปริญญาตรี มีประสบการณ์ด้านการขายหรือขายปลีก 1-2 ปี ติดต่อผู้ซื้อได้ มีประสบการณ์ด้านการขาย FMCG (กลุ่มธุรกิจสินค้าอุปโภคบริโภค) ในตำแหน่งนี้ หากมีประสบการณ์ด้านธุรกิจอาหารจะพิจารณาเป็นพิเศษ มีประสบการณ์การทำงานด้านผลิตภัณฑ์อาหารที่ดูแลตลาดค้าปลีก (ซูเปอร์มาร์เก็ต/ไฮเปอร์มาร์เก็ต) สามารถใช้คอมพิวเตอร์ได้ดี มีบุคลิกภาพดีและมีใจรักการบริการ มีทักษะในการแก้ปัญหา สื่อสาร และเจรจาต่อรองได้ดี มีความกระตือรือร้น ตรงต่อเวลา เปิดใจกว้าง และทำงานหนัก สามารถทำงานภายใต้ความกดดันและตรงต่อเวลาได้ สามารถขับรถได้และมีใบขับขี่ ทำงาน 5 วัน/สัปดาห์ (จันทร์-ศุกร์) 8.30 - 17.30 น. สามารถทำงานที่อาคารรีเจ้นท์เฮ้าส์ได้ (ใกล้ BTS ราชดำริ)"
Urgent...Public Health Station / เจ้าหน้าที่ให้บริการด้านสุขภาพ (Contract),"Touch Technologies Co., Ltd. ",Bangkok,Laboratory & Technical Services,Contract/Temp,,,Job description ให้คำปรึกษา ให้คำแนะนำด้านสุขภาพให้แก่ผู้รับบริการทั้งกลุ่มที่มีร่างกายปกติ กลุ่มเสี่ยง และผู้ที่มีปัญหาด้านสุขภาพโรคต่างๆ ที่มาใช้บริการ ณ หน่วยให้บริการ ให้คำแนะนำ บริการคัดกรอง ตรวจสุขภาพเบื้องต้นให้แก่ผู้รับบริการ โดยใช้เครื่องมือ และอุปกรณ์ประจำหน่วยบริการ บันทึกข้อมูลการใช้งานรวมถึงปัญหาที่เกิดขึ้น สามารถแก้ไขปัญหาที่เกิดขึ้นเบื้องต้นได้ ทำแบบประเมินความเสี่ยงคัดกรองต่างๆตามกลุ่ม NCDs ที่กำหนดและบันทึกข้อมูลลงในระบบ ตรวจสอบดำเนินงานด้านประชาสัมพันธ์และการสื่อสารความเสี่ยงด้านสุขภาพแก่ชุมชน เพื่อให้ประชาชนมีความรู้ สามารถป้องกันตนเองจากโรคและภัยสุขภาพ ศึกษา  ค้นคว้า  วิเคราะห์  วิจัย  สำรวจ รวบรวม ข้อมูลทางวิชาการเบื้องต้นที่ไม่ซับซ้อน  เกี่ยวกับงานด้านสาธารณสุข เช่น  การส่งเสริมสุขภาพ  การเฝ้าระวังโรค  การควบคุมป้องกันโรคและภัยสุขภาพ  และการฟื้นฟูสุขภาพ สรุปรายงานเกี่ยวกับการดำเนินงาน  หรือรายงานการรวบรวมข้อมูลทางวิชาการด้านสาธารณสุข  เสนอผู้บังคับบัญชา  เพื่อประกอบการวางแผนในการปฏิบัติงาน ร่วมพัฒนาเนื้อหา  องค์ความรู้  คุณภาพมาตรฐานเกี่ยวกับงานด้านสาธารณสุข  และระบบบริการสุขภาพ  โดยบูรณาการแบบองค์รวมว่าด้วยการคุ้มครองและส่งเสริมภูมิปัญญา  เกี่ยวกับงานด้านสาธารณสุขและระบบบริการสุขภาพ  และจัดทำคู่มือ  แนวทางปฏิบัติ  เอกสารวิชาการ  สื่อสุขศึกษา  ประชาสัมพันธ์  เพื่อให้ประชาชน มีความรู้ สามารถ ป้องกันตนเองจากโรคและภัยสุขภาพ ประสานการทำงานร่วมกันทั้งภายในและภายนอกทีมงานหรือหน่วยงาน เพื่อให้เกิดความร่วมมือและผลสัมฤทธิ์ตามที่กำหนดไว้ ดูแลความสะอาดเรียบร้อยและสิ่งแวดล้อมของหน่วยให้บริการ คุณสมบัติ ปริญญาตรี วิทยาศาสตร์บัณฑิต สาขาสาธารณสุขศาสตร์ หรือสาขาที่เกี่ยวข้อง ยินดีรับนักศึกษาจบใหม่
