Job_Title,Company,Location,Job_Position,Job Position,Salary Min,Salary Max,Job_Description,Tag
เจ้าหน้าที่การตลาดอาวุโส/Online Marketing,Srithai Superware Public  Company Limited,"Rat Burana, Bangkok",Marketing Communications,Full time,,,รายละเอียดงาน สร้างยอดขายในช่องทาง Offline และ Online ประชาสัมพันธ์ เพื่อให้ลูกค้าเข้าถึงกลุ่มเป้าหมายให้มากที่สุด สร้างสรรค์ภาพและสื่อที่เข้าใจได้ง่าย ชักชวนคนให้เข้ามามีส่วนร่วมและสอดคล้องกับทิศทางของแบรนด์ รับผิดชอบสื่อต่าง ๆ ทั้งในช่องทางออนไลน์และออฟไลน์ (โซเชียล ฯลฯ) ติดต่อประสานงานกับหน่วยงานที่เกี่ยวข้อง การวาง Lay Out พื้นที่จัดกิจกรรมต่างๆได้ มีประสบการณ์ที่เกี่ยวข้องกับงานออกแบบสื่อ/บรรจุภัณฑ์ และออนไลน์ อย่างน้อย 3-6 ปี คุณสมบัติ ปริญญาตรี ในสาขาออกแบบกราฟฟิก หรือสาขาอื่นๆ ที่เกี่ยวข้อง มีประสบการณ์ทำงานการออกแบบหรือครีเอทีฟ (3-6 ปี) มีความรู้ด้านการตลาดทั้ง Offline และ Online,"Advertising,Arts & Media"
ACCOUNT MANAGER  / ACCOUNT EXECUTIVE/ACCOUNT MANAGER  / ACCOUNT EXECUTIVE,บริษัท เรลเลเวนท์ ออเดียนซ์ จำกัด,"Bang Na, Bangkok",Other,Full time,,,"We are looking for Thai National ACCOUNT EXECUTIVE and ACCOUNT MANAGER with a good understanding of all main marketing channels from Google Ads (search, display, shopping, universal campaigns etc) to Facebook ads, SEO, Linkedin ads etc. - Maintain and develop a good relationship with existing clients and acquire new clients for business growth including proposal pitching. - Recommend marketing strategy for clients across social medial, online marketing, and digital media optimization and consulting clients about project requirements. - Presenting campaign pitches and budgets to clients. - Support day-to-day operation in content creation, social media management, and promotion management and business analytics. - Coordinate with internal departments (digital media team, creative team and operation team) or 3rd party service partners to ensure deliverable in a timely manner. - Monitoring work progress and keeping in contact with clients at all stages. - Prepare reports and conduct performance reviews with clients and internal management on a weekly or monthly basis. Requirements Minimum 2 Years of experience as account executive or account manager Digital Channels like Facebook and Google Ads experience","Advertising,Arts & Media"
Content Creator,"Tomorrow (Thailand) Co.,Ltd","Samphanthawong, Bangkok",Art Direction,Full time,,,"Job Descriptions: Create a creative campaign for all kind of campaign and artwork Understand clients' needs and objectives and work closely with team throughout campaigns and projects. Muli-tasks, working on several campaigns at once, under pressure and against tight timeline. Keeps up-to-date with popular culture and trends on/offline. Qualifications : At least 2 years of direct experience in digital marketing or marketing communications or from digital agency Direct experience in beauty products is a plus Copy writer and Art director are welcome Ability to perform multi tasks, meet deadlines, and strong time management skills Good command of written and spoken English & Thai Welfare & Benefits : A competitive salary and benefits package An opportunity to work in supportive environment Hybrid working day ( 3 days work from office , 2 days at office) Annual bonus Company outing trip Group insurance with Prudential","Advertising,Arts & Media"
Video Editor/ถ่ายและตัดคลิป TikTok,"RED LINE TECHNOLOGY NETWORK CO., LTD.","Huai Khwang, Bangkok",Art Direction,Full time,20000.0,29999.0,"ตำแหน่งงาน : ถ่ายและตัดคลิป TikTok เป็นงาน : พนักงานประจำ ประเภทงาน : โฆษณาCreative นักข่าว : กรุงเทพมหานคร ,เขยห้วยขวาง เงินเดือน : 20000-30000 สำหรับ : 1-2 ปี งานตรวจสอบ ตำแหน่งงาน : ถ่ายคลิปและตัดต่อคลิปแอพพลิเคชั่นพลิเคชั้น TikTok ประเภทงาน : งานเต็มเวลา ต้องเข้าออฟฟิศ ไม่รับwork from home คุณสมบัติ การตัดต่อและตัดต่อวิดีโอและการใช้ TikTok และเนื้อหาสร้างเนื้อหาและมีคุณภาพสูง ในการเลือกฉากและแต่งภาพ ทำทีมได้อย่างมีประสิทธิภาพ การสื่อสารและการทำงานในเรื่อง สวัสดีการ มีวันหยุดนักขัตฤกษ์ มีประกันสังคม สมัครงานติดต่อ คุณมายด์ Tel : 0841715438 Line ID: 0828955221","Advertising,Arts & Media"
Account Director (Sale & Client Services),"Like Me Co., Ltd.",Bangkok,Other,Full time,,,"Job Description : • Manage the sales team and Client Services team • Client Relationship Management: Build and maintain strong relationships with clients, serving as their primary point of contact. Communicate regularly with clients to understand their needs and objectives, and provide strategic guidance to help achieve them.• Project Management: Oversee the development and implementation of advertising and marketing campaigns, from ideation to execution. Ensure that projects are delivered on time, within budget, and to the satisfaction of the client. • Team Management: Lead and manage a team of account managers and executives, providing guidance and support to ensure they are equipped to meet the needs of clients. • Strategic Planning: Work with clients to develop and implement strategic plans to achieve their business objectives. Stay up-to-date on industry trends and best practices, and apply them to clients' campaigns as appropriate. • Budget Management: Manage project budgets, track expenses, and ensure all costs are accurately captured in the agency's financial system. • New Business Development: Identify new business opportunities and work with the Managing Director to develop proposals and pitch presentations. • Reporting: Generate regular reports on project progress, budgets, and client satisfaction levels. Use data to identify areas for improvement and make recommendations for future campaigns. • Quality Control: Ensure that all deliverables meet the agency's quality standards and the client's expectations. Requirements: • Bachelor's degree in marketing, communications, or a related field • At least 7 years of experience in account management in an advertising or marketing agency, with a focus on creative client servicing • Strong leadership and management skills, with experience leading a team of account managers and executives • Excellent communication and interpersonal skills, with the ability to build and maintain strong client relationships • Strong project management skills, with the ability to manage multiple projects simultaneously • Strategic thinking and problem-solving abilities • Experience with budget management and financial reporting • Knowledge of industry trends and best practices, with the ability to apply them to clients' campaigns as appropriate. • The Account Director is a key leadership role within the agency's creative client servicing department. The role requires strong communication, leadership, and strategic thinking skills, as well as a deep understanding of advertising and marketing campaigns. The successful candidate will be able to manage and motivate a team of account managers and executives, build strong relationships with clients, and deliver exceptional service and results.","Advertising,Arts & Media"
Creative & Content Creator (มีประสบการณ์อย่างน้อย 2 ปี) เพจ Deomate,"Alphabet Associate Co., Ltd.","Bang Khun Thian, Bangkok",Art Direction,Full time,,,"หน้าที่ความรับผิดชอบ 1. วางกลยุทธ์ และสร้างบทความบน Social media หรือบทความองค์กรให้ตรงต่อจุดประสงค์ของการสื่อสาร เพื่อเสริมสร้างภาพลักษณ์ และการขายขององค์กร 2. ระดมความคิดร่วมกับ Marketing team สำหรับการวางแผนคอนเทนต์ 3. รับผิดชอบการวาง และจัดตารางการลงคอนเทนต์ประจำวัน สัปดาห์ เดือน 4. มีความสามารถในการทำ Graphic design และ Video editor เพื่อให้มีความสอดคล้องกับบทความ 5. คิดคอนเทนต์เป็น สร้างสรรค์คอนเทนต์ได้หลากหลายรูปแบบ เขียนสคริปต์รายการ / โฆษณา 6. ดูแล Social Content ทั้งหมดของบริษัท Facebook, YouTube, Line, Instagram, TikTok ไม่ใช่แอดมิน แต่ดูภาพรวมของเนื้อหา Social media Content 7. สามารถระบุกลุ่มเป้าหมายที่ต้องการจะสื่อสารข้อความขององค์กร ติดตามเทรนด์ ความเคลื่อนไหวตามโซเซียลมีเดียอย่างสม่ำเสมอ 8. คิด content เพื่อสร้างยอด engagement, like & share 9. ทำ Report สรุปการทำ Social Content และหาแนวทางในการทำให้ทุก Platform ดีขึ้น 10. รับผิดชอบในการทำ Content เพื่อผลักดันยอดขาย บนช่องทาง online 11. รายละเอียดผลิตภัณฑ์ www.deomate.com คุณสมบัติด้านความรู้และความสามารถ 1. มีประสบการณ์ทางด้านงานเขียน Content Creator อย่างน้อยไม่ต่ำกว่า 2 ปี 2. มีความรู้ ความเข้าใจในส่วนของ Social media เป็นอย่างดี 3. มีความละเอียดในการทำงานสูง และความรู้การใช้ตัวสะกดและไวยากรณ์ภาษาไทยอย่างถูกต้อง 4. สามารถใช้ Adobe Photoshop , Adobe Illustrator ,Canva หรือโปรแกรมที่ใช้ในการตัดต่อVDO ได้เป็นอย่างดี 5. มีความคิดสร้างสรรค์ สามารถออกแบบงานเขียน Content ที่มีจุดเด่น เหมาะสมกับจุดประสงค์ได้เป็นอย่างดี 6. กระตือรือร้น มีความรับผิดชอบสูง และตอบสนองอย่างรวดเร็ว 7. ติดตาม วิเคราะห์ และวัดผลกิจกรรมในแต่ละช่องทางการขาย","Advertising,Arts & Media"
Creative Marketing (GMM MUSIC),GMM Grammy Public Company Limited,"Vadhana, Bangkok",Art Direction,Full time,,,- Develop Creative solution - Develop proposal / Strong Keynote & PowerPoint skills - Understand CREATIVE Campaign planning process / Entertainment Marketing and Media is a plus - At least 2-4 year of work experience in advertising and a related field - Interest in music and entertainment marketing - Creative and self-motivated is a must! - Strong attention to detail and ability to manage multiple tasks - Good communication skills and presentation skills,"Advertising,Arts & Media"
Digital Creative Manager - Art Director,"Prime Media Co.,Ltd.","Chatuchak, Bangkok",Art Direction,Full time,,,"Job Description Working with other members of the design department to evaluate client or company needs, develop concept, and create visual elements for ad campaigns or contents. Speaking with the client to provide updates, receive feedback, and present the final campaign. Conducting research to better understand brand objectives, target markets, and industry trends. Supervising design staff. Coordinating resources and with other departments to create a cohesive, effective campaign. Thinking as Multi-Media Visualization Troubleshooting design or process problems as they arise. Ensuring that all aspects of the campaign align with the needs of the client or company. Looking for ways to improve design processes. Qualification: Bachelor’s degree in graphic design, marketing, or related field. 3-5 year of experience in graphic design, art director in an agency Experience in copy writer is a plus Proficiency in graphic design software High level of accountability and motivation. Strong Interpersonal, time and project management, presentation, Self-learning, and communication skills. Creativity and ability to delegate responsibilities. Receptiveness to feedback and adaptability","Advertising,Arts & Media"
Prepress Specialist,Amcor Flexibles Bangkok Public Company Limited,"Bang Phli, Samut Prakan",Art Direction,Full time,,,"This prepress technical specialist checks proofs of newspapers, magazines, and other print materials to make sure formatting, text, and color are correct before printing begins. Responsibilities: Review and correct format and layout of artwork Set up printing press equipment, and performing maintenance on printing presses Perform “preflight” check for required fonts, colors, sizing, resolution and other needed components to ensure completeness prior to submitting to printer Format, color correct and manipulate files according to client specifications Setup of files including enlargements, composing and processing of files prior to forwarding to various printers Identify missing or problematic components of job and communicate accordingly Other duties as assigned from Prepress Plant Manager Required Skills: Strong knowledge of design/layout/image/color editing software is essential, specifically: Adobe InDesign, Illustrator, Photoshop, and Acrobat Knowledge of Microsoft Office Knowledge of the digital printing process and print file preparation. Ability to address and troubleshoot file issues. Detail oriented Prepress or Large Format printing experience a plus. Ability to adapt to changing priorities, multi-task and meet deadlines. Self-Starter with the willingness to take initiative.","Advertising,Arts & Media"
Senior Photographer,"SSUP HOLDINGS CO., LTD.","Ratchathewi, Bangkok",Art Direction,Full time,,,Job Responsibilities: ดูแลและควบคุมการผลิตงานถ่ายภาพนิ่ง บริหารจัดการทีมได้อย่างเข้าอกเข้าใจ มีความเข้าใจเรื่องพื้นฐานการใช้สื่อสิ่งพิมพ์และดิจิตอลเพื่อความเหมาะสมในการนำภาพไปใช้ในช่องทางต่าง ๆ อย่างถูกต้อง รับบรีฟติดต่อประสานงานทั้งกับลูกค้าและภายในทีมได้อย่างไม่มีตกหล่น วางทิศทางการทำงานร่วมกับทีมและลูกค้า คิดริเริ่มสร้างสรรค์โปรเจ็คงานถ่ายภาพนิ่งต่าง ๆ ติดตามเทรนด์การถ่ายภาพอยู่เสมอโดยเฉพาะงานเกี่ยวกับ Beauty เพื่อนำเสนอมุมมองใหม่ ๆ นำเสนองานกับลูกค้าได้อย่างน่าสนใจไม่ว่าจะเป็นทิศทางของภาพแสงเงาการใช้พรอพและ Reference ต่าง ๆ เพื่อให้ลูกค้าเห็นภาพและนำภาพไปใช้สื่อสารอย่างชัดเจน บริหารจัดการการทำงาน วางตารางงานและลำดับขั้นตอนการถ่ายทำได้ ติดต่อประสานงานทั้งกับลูกค้าและภายในทีมอย่างรวดเร็วด้วยความละเอียดรอบคอบ ดูแลจัดการงบประมาณที่ได้รับมอบหมายได้อย่างคุ้มค่า พร้อมแก้ทุกปัญหา มีทางออกให้ลูกค้าและทีมอยู่เสมอ Qualifications: มีประสบการณ์การถ่ายภาพนิ่ง อย่างน้อย 3 ปี มีทักษะในเรื่องของการถ่ายภาพการจัดองค์ประกอบแสงเงาและมุมมองภาพต่าง ๆ มีทักษะในการติดต่อสื่อสารเป็นอย่างดี มีความประนีประนอมรับฟัง ร่วมแสดงความคิดเห็นและกล้าตัดสินใจ มีความสามารถในการบริหารจัดการแก้ปัญหา มีความรับผิดชอบส่งงานลูกค้าตามกำหนด มีความกระตือรือร้นและตื่นตัวในการทำงาน มีไอเดียความคิดสร้างสรรค์ตามเทรนด์ มีความสนใจเรื่องสกินแคร์เมคอัพเป็นพิเศษ สามารถทำงานนอกสถานที่นอกเวลาได้ หรือมาทำงานวันเสาร์ในบางกรณี *ผู้สนใจสามารถส่งใบสมัครพร้อมแนบผลงานของท่าน (Portfolio) เพื่อประกอบการพิจารณา*,"Advertising,Arts & Media"
Marketing Producer,"NY.LA GROUP Co., Ltd.","Lak Si, Bangkok",Art Direction,Full time,20000.0,24999.0,"We are looking for someone with a : Creative mind and energetic personality Passion for fashion and streetwear Young and fresh mindset, always in trend and up to date Able to handle high pressure in a fast paced environment Skilled in photography and retouching (videography is a bonus) Scope of work Content Creator (work with brand manager every step) Monthly content plan for brand (omni-channel) Copywriting for each post to create desire and engagement Schedule posts on specified platforms Coordinate with KOLs if required Producer Create banners for online marketplace and events Produce assets from start (brief) to finish (ready to post) If photoshoot required; production plan, work with models to shoot high quality assets or direct photographer to create results Editing and retouching raw assets from photoshoot Graphics editing to create final content ready for posting on specified platforms Requirements Proficient in illustrator, photoshop, lightroom Daily user of social media; Facebook, Instagram, Line@, TikTok (is a bonus) Has their own photography equipment; camera, flash, tripod, spare batteries Has their own editing equipment; laptop, software","Advertising,Arts & Media"
Campaign & CRM Execution Manager,Central Group (Central Pattana Public Company Limited),"Pathum Wan, Bangkok","Media Strategy, Planning & Buying",Full time,,,"Responsibilities: Lead the execution of commercial marketing campaigns and activities to ensure flawless brand presence and business direction Develop the marketing campaigns and initiative to drive sales revenue, shopper experience and business performance that align with business goals Drive commercial marketing performance, anticipates causes affecting performance, indicates magnitude of impact on sales and provide Management, Operation and Finance with attractive promotion campaigns Ensure all marketing activities are delivered compelling content throughout all stages of the customer life cycle, including campaigns evaluation and ROI Partner with operations teams in identifying new business opportunities and commercial innovation to fulfill financial target and maintain existing clients Qualifications: Bachelor's degree or higher in Marketing, Advertising, Economics, or related fields Minimum of 5 years’ experience in Corporate Marketing, CRM, and Commercial Marketing with a focus on campaigns management Experience in defining and managing marketing initiatives to address multiple and different target customer segmentations for different business types Proven track record in innovating and creative thinking with customer champion with excellent commercial awareness and understanding of customer needs Strong influencing and communication skills and ability to manage several different stakeholders Exceptional written, verbal and presentation communication skills","Advertising,Arts & Media"
