Job_Title,Company,Location,Job_Position,Job Position,Salary Min,Salary Max,Job_Description,Tag
Media Planner/ Senior Planner/ Planning Manager,WPP (THAILAND) LTD. - GROUPM,"Khlong Toei, Bangkok","Media Strategy, Planning & Buying",Full time,,,"GroupM is the world's largest media investment company and are a part of WPP. In fact, we are responsible for one in every three ads you see globally. We are currently looking for Media Planner/ Senior Planner/ Planning Manager to join us. In this role, you will be responsible for preparing and implementing successful communication strategies founded in client's business objectives and relevant research. In this role, your duties will be varied and challenging. You will utilize your in-depth knowledge of consumer behavior, trends and the media landscape to create insightful strategies for our clients. At GroupM APAC, our people are our strength, which is why fostering a culture of diversity and inclusion is important to us. 3 best things about the job: A learning environment with mentorship Opportunities to work across local and international client and agency teams Performance driven role with a focus on growing business Responsibilities of the role: Besides planning, overseeing, and driving operational needs of your clients; you would also be in-charge of being a digital consultant to the clients by advising, guiding and shaping your clients’ digital work. While growing existing business will be key, you will also be assisting your senior agency teams in new business development strategies and plans during pitches. What you will need: Under graduate degree in communication or media or business management (Post-graduate/masters preferred) 1 to 5 years of experience in media planner (or a role that covers above knowledge areas) Fluency in Thai and English (both written and spoken) High confidence levels to work with mid to senior level clients (both local and regional/global) Knowledge required in - media insights and analysis for planning, reporting and insights on campaigns, performance marketing and programmatic buying Candidate should be able to present thoughts, plans and ideas in a clear and succinct manner (on a PowerPoint, Excel, or otherwise)","Advertising,Arts & Media"
"Senior Account Executive (Offiline, Out of Home Media OOH) - Egg Digital","Ascend Group Co., Ltd.","Bang Na, Bangkok",Other,Full time,,,"Job Description Client Account Management: Take charge of documenting products and services for client accounts and ensuring that client needs are met and exceeded Client Relationship Building: Develop and maintain long-lasting relationships with client accounts, serving as their primary point of contact for all needs and inquiries Cross-Functional Collaboration: Collaborate effectively with internal and external departments to understand client requirements and deliver comprehensive solutions Quality Assurance: Maintain strict control over the quality of work, ensuring that all deliverables meet established standards and are delivered on time Client Support: Offer expert advice and recommendations to clients before and after service delivery, ensuring their satisfaction and success Professional Growth: Embrace a growth mindset and consistently seek opportunities for personal and professional development Problem Solving: Be prepared to handle unexpected challenges and excel in negotiation when required Your Experience and Qualification in: Educational Background: A Bachelor's degree or higher in Management, Marketing, or Business is preferred Work Experience: A minimum of 3 years of relevant working experience, with a strong background in account management. Experience in Account Executive Digital Marketing or Online Business is a plus Language Skills: Proficiency in English is advantageous Technical Proficiency: Proficiency in basic Microsoft Office applications Personal Attributes: Display qualities such as energy, intelligence, quick-wit, and exceptional interpersonal skills Work Ethic: Demonstrate a high degree of discipline, the ability to work diligently, attention to detail, and the capacity to perform effectively under pressure Customer Focus: Exhibit a strong commitment to delivering exceptional customer service Continual Learning: Be open to learning new concepts and committed to self-improvement","Advertising,Arts & Media"
"Art Director (VISA SUPPORT), up to 60-70k/THB",Page Group Thailand,Bangkok,Other,Full time,45000.0,69999.0,"A leading Marketing Agency nestled in the heart of Bangkok, Thailand, we specialize in creating impactful and trend-setting marketing campaigns for a diverse range of clients. Our dynamic team thrives on innovation and creativity, fostering an environment that encourages professionals to push boundaries and make a lasting impact on the marketing landscape hiring for Art Director. Description Collaborate with clients to conceptualize marketing initiatives. Lead the artistic direction of campaigns. Ensure visual consistency and brand alignment. Stay updated on industry trends for creative inspiration. Profile Proven experience in art direction. Strong portfolio showcasing creative projects. Excellent communication and collaboration skills. In-depth knowledge of current design trends. Job Offer Embark on a creative journey in bustling Bangkok, where our Marketing Agency is revolutionizing the industry. As an Art Director, you'll have the opportunity to shape cutting-edge campaigns, supported by a team committed to pushing creative boundaries. Enjoy the added benefit of full work visa support as you contribute to our dynamic and innovative work culture. To apply online please click the 'Apply' button below. For a confidential discussion about this role please contact Kei Hatayama.","Advertising,Arts & Media"
Creative Art Director,"ORO (Thailand) Co., Ltd.","Khlong Toei, Bangkok",Art Direction,Full time,,,"You will help develop creative ideas and art direction by conducting research, coordinating with the planner team, and designing cohesive, brand-specific initiatives that appeal to the target demographic. You will lead art direction and take part in the entire campaign development process and ensure the quality of the art throughout the project. That said, the bulk of your working hours should involve you having to Take a crucial role in pitching for new clients. Create art direction, Mood board  and artworks Generate clear ideas and concepts in tandem with the copywriter Produce sketches, storyboards, roughs to visualize ideas Understand marketing initiatives, strategic positioning and target audience Take work from concept to final execution within deadlines Present completed ideas to clients/team members Stay on top of all trends and maintain best practices Qualifications & Skills Portfolio with successfully launched projects, integrated campaigns and digital / social lead campaigns. 3 years of Experience in Advertising agency Be highly creative and imaginative, with in target’s insight Have an eye for detail and interest in commerce, popular culture, and new advertising trends and techniques. Hands on experience with graphic design for social media campaigns Proficient use of Photoshop, Illustrator or other visual design Incorporate feedback and take/give direction well Team player with strong communication and presentation skills Infographics Motion graphic skill is a plus Moderate English skill Office Location: T-One Tower (WeWork), 15-17th and 20th floor, Sukhumvit 40 Alley, Phra Khanong  Sub-District, Khlong Toei District, Bangkok Our working model: 5 working days (hybrid) - work from anywhere 2 days/ week 8 working hours (flexible) start from 7.00-10.00 a.m. Official hours: Mon - Fri, 9.00 a.m. - 6.00 p.m. Our Benefit: Transport allowance/ Living cost allowance Barista bar 9 a.m. - 3 p.m. Group Insurance Annual leave 8-20 days","Advertising,Arts & Media"
Designer - Social Media Content Creator/ออกแบบ - โซเชียลมีเดียคอนเทนต์ครีเอเตอร์,"Asia Media Studio Co., Ltd.","Vadhana, Bangkok",Art Direction,Full time,,,"Asia Media Studio is a creative agency based in Bangkok that’s been operating for 15 years. We successfully partner with corporate clients such as Nissan, Formica, Baxter, Villeroy & Boch but also with SMEs to create compelling branding and marketing strategies that help our clients to achieve that differentiation from the competition and draw customers to them. Our main focus is branding, web design, and digital marketing including brand awareness and lead generation in both B2B and B2C. We are coming from the branding industry therefore we have high expectations for creativity when we manage campaigns. Our office is located in the center of Bangkok (Asoke) with an international team of 25+ members. We are looking for someone motivated preferably with a bit of experience/knowledge in the field to get hands-on with our marketing campaigns for local and international clients. Qualifications / Skills: Proficiency in graphic design, with extensive experience using Adobe Suite (Photoshop, Illustrator). Demonstrated experience in designing visually compelling social media content, Including innovative design concept & key visuals. . A portfolio showcasing some design work, including social media projects. An understanding of social media trends and the ability to create content that stands out. Excellent communication skills and a keen interest in client interaction and creative briefing. Ability to develop creative strategies and translate them into effective social media content. A proactive, organized mindset, capable of independently solving problems and managing tasks. Understanding of Branding: Ability to adhere to brand guidelines and maintain consistent visual identity across various social media platforms. Proficient in seeking design direction to present to clients and adept at formulating comprehensive design briefs. Key Skills and Responsibilities: Designing and creating visually engaging social media content that aligns with client branding and marketing objectives. Actively participating in client meetings to understand their vision and contribute to creative briefs. Collaborating closely with internal teams (Campaign Managers, Designers) and external partners (Photographers, Videographers, Client Teams) to ensure high-quality content creation. Managing social media content from concept to execution, including the client brief - Designing the post or coordinating the designer internally, gathering client feedback. Maintaining strong, productive relationships with clients, acting as a key liaison for design and content needs. Education, Experience, and Licensing Requirements: Fluent in English and Thai. 3 years of experience in a design-focused role, preferably in an agency setting. Bachelor in design & communication or related field Benefits: Competitive salary with Junior or Senior positions available. Office located in the heart of Bangkok. Hybrid Work-from-Home policy (1 day per week currently) Part of a multicultural team. Company-provided Apple MacBook. Private Medical Insurance. Budget for online training and skill development Yearly Bonus","Advertising,Arts & Media"
Online Content Specialist,"ITOPPLUS Co., Ltd.","Din Daeng, Bangkok",Art Direction,Full time,,,"Key Responsibility: Study and analyze products ,Consumer behavior data ,trends or useful information for planning content. Analyze and determine the way of content through images, text or other elements to meet the objectives of the job Plan and create contents for various channels such as Facebook, Blog, Website, Instagram, Line @ and Google. Brief Graphic team to create content illustrations Create and improve Facebook & Instagram advertising campaigns Review and analyze advertising resulting on Facebook & Instagram Analyze customers, trends and business in order to provide , to approach  and to achieve insight users ’needs. Key Competencies: Be Passionate about reading, learning new things and self improving. Be creative and like challenging. At least 1-4 year of experience in Google advertising or online marketing. High endurance and be able to work as a team. Be knowledgeable and understandable of target group and principle of marketing. Interested in online marketing. Interested in consumer behavior. Be able to work overtime if required.","Advertising,Arts & Media"
Marketing Planner,"SANGHAI CUISINE CO., LTD.","Bang Kho Laem, Bangkok","Media Strategy, Planning & Buying",Full time,30000.0,44999.0,หน้าที่วามรับผิดชอบ วางแผน Media Plan Online & Offline คิดและผลิต Content สร้าง Engagement กับลูกค้า เพื่อเพิ่มการรับรู้ของแบรนด์ ยิงโฆษณา Facebook / Instagram / TikTok สามารถวิเคราะห์แนวทางการตลาดภาพรวมได้ ติดต่อประสานงานกับสถานที่ตั้งร้านค้า เพื่อวางแผนการตลาดร่วมกัน สรุป โฆษณาในแพลตฟอร์ม อัพเดทข้อมูลและเทรนด์การตลาดออนไลน์ คุณสมบัติผู้สมัคร มีประสบการณ์การทำการตลาดมากกว่า 3 ปี มีประสบการณ์ทำการตลาดด้านอาหาร มีประสบการ์การใช้ Canva/Photoshop สวัสดิการ ทำงาน 5 วัน/สัปดาห์ โบนัสตามผลประกอบการ,"Advertising,Arts & Media"
Digital Marketing Manager / Digital Marketing Executive,CHARME CORPORATION PUBLIC COMPANY LIMITED,"Bang Khen, Bangkok","Media Strategy, Planning & Buying",Full time,45000.0,69999.0,"Responsibility Ads Optimization and Media Conversion is a must Ensure understanding of all brand portfolio deliverables and campaign KPIs. Strong understanding of understanding media behaviors and how the target audience interact with specific channel delivery and ensure common understanding Proactively address, and when needed escalate, any issue that compromises the quality and timeliness of deliverables Provide technical perspective in client meetings when specific expertise is required Maintain quality control and assurance practices across the assigned cluster of clients and proactively advice Agencies on campaign improvements Maintain and comply with finance processes (such as month end reconciliations), Facilitate and influence cross-function collaboration by demonstrating openness to new ideas and interest in learning from colleagues with different expertise Encourage knowledge share and continuous learning Serve as key point of contact on brief delivery responses and tactical strategies/responses Compile all necessary media recommendations (i.e. media schedules) Oversee end-to-end project management of campaign brief and delivery Be responsible across all campaign tracking and reconciliation requirements (including KPI delivery) Share regular updates with Agencies on campaign performance, such as in-flight optimizations and necessary schedule adjustments Consolidating data for ad hoc based reports (e.g. CSI/Savings Report/Cost Avoidance) Deliver holistic cross channel campaign analysis (i.e. mid and post campaign reports) working with respective buying teams to provide actionable insights and optimization recommendations Identify new product opportunities that will enhance clients’ digital front Roll out test and learn initiatives to drive continuous improvements in campaign performance Take an active role in developing broader biddable or digital strategic recommendations and best practices to scale impact at market and regional level Qualification Bachelor degree or above in related field At least 5 years of experience. Knowledge in digital marketing, marketing communication and media advertising. Experience in oversee end-to-end project management of campaign. Knowledge about search keyword and boot up ad performance","Advertising,Arts & Media"
Ads Optimizer / Media Buyer,Wise Sphere Company Limited,"Pak Kret, Nonthaburi","Media Strategy, Planning & Buying",Full time,,,"Core Responsibilities: Manage and execute digital advertising campaigns across various platforms (such as Facebook, Shopee, Lazada, TikTok and Google Ads is a plus) to drive traffic, leads, and sales. Continuously monitor and optimize advertising campaigns for maximum performance and return on investment. Conduct A/B testing and adjust ad creatives, targeting, and bidding strategies accordingly. Analyze campaign data to gain insights into customer behavior and campaign effectiveness. Provide regular reports and recommendations based on data-driven insights. Collaborate with content creators and sales team about essential issues  to enhance strategies and improve purchase conversion. Coordinate with third parties for solving any problems to get the best suitable results Stay updated about industry trends,  and competitor strategies to identify opportunities and threats. Post content in every platforms Qualifications and Educational Background: Bachelor's degree in Marketing, Business, or a related field. Proven experience 2 years in performance marketing, digital advertising, or a similar role, Experienced in startup is a plus. Growth mindset and learning skills Strong analytical, data interpretation, teamwork and communication skills. Proficiency in digital advertising platforms (such as Facebook, Shopee, Lazada, TikTok, Google ads is  a plus). Strong project management skills and attention to detail.","Advertising,Arts & Media"
Business Consultant (Event Management),"TALENTVIS RECRUITMENT (THAILAND) CO., LTD.","Vadhana, Bangkok",Art Direction,Full time,,,"Job Description: Sales pitching and leading new clients Responsible for developing and growing the business while also seeking opportunities for expansion of the business into the services spectrum Maintaining the relationship with the client (Account Manager) The preparation of commercial proposals Developing and implementing outreach plans to meet sales KPI and targets Communicate with a customer audience to create on-site events and promote brand product/service knowledge. Prepare event result report for client-side Adaptable to support onsite event operation from start to finish Requirements: Bachelor in Mass communications, Arts, Communication Arts or related fields. Must have a B2B sales in service business At least 1-2 years of experience in sales, Business Development MICE, Event Management, Event Marketing & Organizer Business background would be advantages Strong in sales, customer relationship and people skills Good command in English for both Speaking and Writing Good presentation skills Possess strong problem-solving skills and creative thinking Candidates must be able to work under tight schedule/ timeline stipulated","Advertising,Arts & Media"
Account Manager/Director (40K-80K),"360 Quality Management Co., Ltd.",Bangkok,Other,Full time,,,"Location         : Asoke area Salary Range : 40,000 - 80,000 THB Job Type         : Full-Time, In-Office 100% My client is a dynamic and innovative firm specializing in cutting-edge digital marketing solutions. As we continue to expand, we are seeking a skilled and experienced professional to join our team as an Account Director. Responsibilities 1. Client Engagement: - Interface with clients to understand their objectives and requirements. - Obtain client briefs and ensure clear communication of expectations. - Foster strong, positive relationships with clients, acting as the main point of contact. 2.Team Collaboration: - Distribute client briefs to the relevant teams, ensuring a comprehensive understanding of project goals. - Collaborate with internal teams to develop effective and creative digital marketing strategies. - Provide guidance and support to team members throughout the project lifecycle. 3.Business Development: - Identify opportunities for upselling and expanding services with existing clients. - Explore and pursue new business opportunities to drive agency growth. - Develop and present proposals and offers to potential clients. 4.Operational Excellence: - Ensure projects are delivered on time, within scope, and meet or exceed client expectations. - Implement efficient project management processes to optimize workflows. - Maintain a deep understanding of industry trends and digital marketing best practices. Qualifications - Minimum of five years of experience in a similar role within the digital marketing industry. - Excellent written and verbal communication skills in English. - Ability to effectively convey complex ideas and information. - Strong financial management skills with the ability to handle project budgets. - Proven ability to work collaboratively with cross-functional teams. - Self-motivated with a proactive approach to problem-solving. - Ability to take initiative and drive projects forward. - Keen understanding of digital marketing trends and a passion for innovation. If you are a results-driven professional with a passion for digital marketing and a proven track record of successful account management, we invite you to apply for this position or you can send to sarawan.w@ 360qm.co.th for more information please call/line 065-232-4155 All applications will be treated in strict confidence. All material submitted in connection with your application will become part of our confidential recruitment files. We regret that only shortlisted candidates will be notified. By submitting your curriculum vitae or personal data to us in connection with your job application, you are deemed to have read and agreed to the terms of our Privacy Policy, and consented to the collection, use and disclosure of your personal data by us and our affiliates, in accordance with our Privacy Policy. Please visit www.360qm.co.th for a copy of our Privacy Policy. If you wish to withdraw your consent, please drop us an email to let us know.","Advertising,Arts & Media"
